TAG	RAZSOC	ENDERECO	COMPL	LOCALIDADE	UF	Full Address	Latitude	Longitude	CEP	U_DESCNAE
00015703000193	EMPRESA LIMPADORA SILVINO LTDA	JABOTICABAL	1521	SAO PAULO	SP	JABOTICABAL 1521 SAO PAULO SP 	-235681533	-465749715	03188002	SERVIÇOS PARA EDIFÍCIOS E ATIVIDADES PAISAGÍSTICAS
00015732000155	GRUPPAR EMPREENDIMENTOS LTDA.	SAO CARLOS DO PINHAL	696	SAO PAULO	SP	SAO CARLOS DO PINHAL 696 SAO PAULO SP 	-235621944	-4.66532E+15	01333000	ATIVIDADES DE SERVIÇOS FINANCEIROS
00015755000160	EDINEIDE DE ANDRADE BARBOSA MARTINS LOPES	BARAO DO TRIUNFO	233	JUNDIAI	SP	BARAO DO TRIUNFO 233 JUNDIAI SP 	-231897916	-468868948	13207770	COMÉRCIO VAREJISTA
00015768000139	GOIANIA CART DE REGISTRO DE IMOVEIS DA 2 CIRCUNSCRICAO	JOAO  DE ABREU	145	GOIANIA	GO	JOAO  DE ABREU 145 GOIANIA GO 	-166893451	-492656483	74120110	ATIVIDADES JURÍDICAS, DE CONTABILIDADE E DE AUDITORIA
00015796000156	D:LIVROS EDITORA E DISTRIBUIDORA LTDA	IMPERATRIZ LEOPOLDINA	1013	SAO PAULO	SP	IMPERATRIZ LEOPOLDINA 1013 SAO PAULO SP 	-235306696	-467310047	05305012	EDIÇÃO E EDIÇÃO INTEGRADA À IMPRESSÃO
00015798000145	OASIS SAO BERNARDO CORRETORA DE SEGUROS LTDA	IMPERATRIZ LEOPOLDINA	454	SAO BERNARDO DO CAMPO	SP	IMPERATRIZ LEOPOLDINA 454 SAO BERNARDO DO CAMPO SP 	-237052521	-465473904	09770272	ATIVIDADES AUXILIARES DOS SERVIÇOS FINANCEIROS, SEGUROS, PREVIDÊNCIA COMPLEMENTAR E PLANOS DE SAÚDE
00015887000191	GERMATEL TELECOMUNICACOES LTDA	GLORIA DO GOITA	229	SAO PAULO	SP	GLORIA DO GOITA 229 SAO PAULO SP 	-235845544	-465599169	03222010	COMÉRCIO VAREJISTA
00015890000105	ITALVISA MAQUINAS LTDA	ANTONIO ROMANO SCHINCARIOL	S/N	TATUI	SP	ANTONIO ROMANO SCHINCARIOL S/N TATUI SP 	-234077328	-4.79234E+15	18278725	FABRICAÇÃO DE MÁQUINAS E EQUIPAMENTOS
00015892000102	UNISILK INDUSTRIA E COMERCIO DE BRINDES LTDA	LAURO GOMES	4899	SAO BERNARDO DO CAMPO	SP	LAURO GOMES 4899 SAO BERNARDO DO CAMPO SP 	-236506078	-465667801	09635010	FABRICAÇÃO DE PRODUTOS DIVERSOS
00015955000112	SDI BRASIL INDUSTRIA E COMERCIO LTDA	DR. VIRGILIO DE CARVALHO PINTO	612	SAO PAULO	SP	DR. VIRGILIO DE CARVALHO PINTO 612 SAO PAULO SP 	-23560716	-46685417	05415020	FABRICAÇÃO DE PRODUTOS DIVERSOS
00015972000150	AUTODESK DO BRASIL LTDA	JAMES JOULE	65	SAO PAULO	SP	JAMES JOULE 65 SAO PAULO SP 	-236111804	-466960753	04576080	COMÉRCIO POR ATACADO, EXCETO VEÍCULOS AUTOMOTORES E MOTOCICLETAS
00016020000150	ASSOCIACAO CULTURAL CHIU JIN DE ARTES E TERAPIAS ORIENTAIS	ANTONIO DINIZ	115	LIMEIRA	SP	ANTONIO DINIZ 115 LIMEIRA SP 	-225766602	-473929378	13480356	EDUCAÇÃO
00016037000108	SUPERTRAT INDUSTRIA E COMERCIO DE PRODUTOS METALURGICOS LTDA	IRMA ANETA SCHNAPP	314	SANTA BARBARA D:OESTE	SP	IRMA ANETA SCHNAPP 314 SANTA BARBARA D:OESTE SP 	-227677542	-47379328	13457194	FABRICAÇÃO DE MÁQUINAS E EQUIPAMENTOS
00016068000169	CAD:S-CONSULTORIA DE SISTEMAS LTDA	BARAO DO FLAMENGO	00028	RIO DE JANEIRO	RJ	BARAO DO FLAMENGO 00028 RIO DE JANEIRO RJ 	-22933082	-431759661	22220080	ATIVIDADES DOS SERVIÇOS DE TECNOLOGIA DA INFORMAÇÃO
00016094000197	GEOLOGIC COMERCIO E PARTICIPACOES LTDA	CRISCIUMA	1680	SAO PAULO	SP	CRISCIUMA 1680 SAO PAULO SP 	-234780708	-4.6578E+15	02225001	COMÉRCIO POR ATACADO, EXCETO VEÍCULOS AUTOMOTORES E MOTOCICLETAS
00016130000112	APM DA EMEIEF PROF. JOSE PAULINO DE ARAUJO VARGAS	ADEMAR DE BARROS	SN	LIMEIRA	SP	ADEMAR DE BARROS SN LIMEIRA SP 	-225742435	-473719865	13480021	ATIVIDADES DE ORGANIZAÇÕES ASSOCIATIVAS
00016133000156	GERBELLI INDUSTRIA E COMERCIO LTDA	DAS ACACIAS	1063	AMERICANA	SP	DAS ACACIAS 1063 AMERICANA SP 	-22756563	-473426522	13468150	FABRICAÇÃO DE MÁQUINAS E EQUIPAMENTOS
00016152000182	JOSE MESSIAS SPOSITO	JOAO PESSOA	140	NOVA ODESSA	SP	JOAO PESSOA 140 NOVA ODESSA SP 	-227778845	-47292733	13460000	CONSTRUÇÃO DE EDIFÍCIOS
00016176000131	IGREJA BATISTA FILADELFIA DE NOVA ODESSA	ALZIRA DELEGA	14	NOVA ODESSA	SP	ALZIRA DELEGA 14 NOVA ODESSA SP 	-227988748	-472867833	13385414	ATIVIDADES DE ORGANIZAÇÕES ASSOCIATIVAS
00016180000108	PABLOS COMERCIAL TEXTIL LTDA	DOS IMIGRANTES	125	AMERICANA	SP	DOS IMIGRANTES 125 AMERICANA SP 	-227472547	-473597897	13471639	COMÉRCIO POR ATACADO, EXCETO VEÍCULOS AUTOMOTORES E MOTOCICLETAS
00016402000184	SOCONTECA SOCIEDADE DE CONTABILIDADE TECNICA LTDA	SHC/S CR QD. 506 BLOCO C	59	BRASILIA	DF	SHC/S CR QD. 506 BLOCO C 59 BRASILIA DF 	-158097042	-479023665	70350535	ATIVIDADES JURÍDICAS, DE CONTABILIDADE E DE AUDITORIA
00016501000166	SILO PARTICIPACAO E ADMINISTRACAO DE BENS LTDA	03 LOTE 1010	SN	BRASILIA	DF	03 LOTE 1010 SN BRASILIA DF 	-158158991	-477720536	71200030	ATIVIDADES IMOBILIÁRIAS
00016576000147	BASEVI CONSTRUCOES S/A	14 CONJUNTO 04 LOTE	07	BRASILIA	DF	14 CONJUNTO 04 LOTE 07 BRASILIA DF 	-156467135	-478155718	71250150	OBRAS DE INFRA-ESTRUTURA
00016667000182	ARABIA INDUSTRIA E COMERCIO LTDA	SETOR DE CONCESSIONARIAS E LOCADORAS	10	BRASILIA	DF	SETOR DE CONCESSIONARIAS E LOCADORAS 10 BRASILIA DF 	-15871326	-47932606	71608050	ATIVIDADES IMOBILIÁRIAS
00016857000108	LAVANDERIA COPACABANA LTDA	SHCS CL QUADRA	204	BRASILIA	DF	SHCS CL QUADRA 204 BRASILIA DF 	-158202434	-479045093	70234520	OUTRAS ATIVIDADES DE SERVIÇOS PESSOAIS
00016905000150	RANDONPREV FUNDO DE PENSAO	ABRAMO RANDON	770	CAXIAS DO SUL	RS	ABRAMO RANDON 770 CAXIAS DO SUL RS 	-2915494	-5.11743E+15	95055010	SEGUROS, RESSEGUROS, PREVIDÊNCIA COMPLEMENTAR E PLANOS DE SAÚDE
00016918000129	LIMA PINHEIRO ARQUITETOS ASSOCIADOS S/S LTDA	OROS	311	SAO PAULO	SP	OROS 311 SAO PAULO SP 	-235432027	-466963994	05442020	"SERVIÇOS DE ARQUITETURA E ENGENHARIA
00016930000133	CANTON - PLANEJAMENTO E MANUTENCAO DE SEGUROS LTDA	EDSON	728	SAO PAULO	SP	EDSON 728 SAO PAULO SP 	-236219732	-4.66757E+15	04618032	SERVIÇOS DE ESCRITÓRIO, DE APOIO ADMINISTRATIVO E OUTROS SERVIÇOS PRESTADOS ÀS EMPRESAS
00016968000106	POSTO DE SERVICOS TALISMA SAO PAULO LTDA	JAUAPERI	45	SAO PAULO	SP	JAUAPERI 45 SAO PAULO SP 	-235989572	-466609805	04523010	COMÉRCIO VAREJISTA
00016985000143	CLINICA ALLEZ DE ODONTOLOGIA E CONSULTORIA LTDA	ELIAS YAZBEK	1871	EMBU DAS ARTES	SP	ELIAS YAZBEK 1871 EMBU DAS ARTES SP 	-236499657	-468486504	06803000	ATIVIDADES DE ATENÇÃO À SAÚDE HUMANA
00017003000138	V. S. HOUSER PARTICIPACOES E INVESTIMENTOS LTDA.	CARLOS PAVAN	172	SAO PAULO	SP	CARLOS PAVAN 172 SAO PAULO SP 	-23584963	-467370723	05535000	ATIVIDADES DE SERVIÇOS FINANCEIROS
00017007000116	LEVISON:S IMAGEM + SOM LTDA	PROFESSOR FREDERICO HERMAN JUNIOR	440	SAO PAULO	SP	PROFESSOR FREDERICO HERMAN JUNIOR 440 SAO PAULO SP 	-235611412	-467023015	05459010	"ATIVIDADES CINEMATOGRÁFICAS, PRODUÇÃO DE VÍDEOS E DE PROGRAMAS DE TELEVISÃO
00017024000153	FUNDO DE INVESTIMENTO RENDA FIXA EXPONENCIAL	CIDADE DE DEUS S/N	S/N	OSASCO	SP	CIDADE DE DEUS S/N S/N OSASCO SP 	-235474158	-467664053	06029900	ATIVIDADES DE SERVIÇOS FINANCEIROS
00017026000142	DEVAL INSTRUMENTOS MUSICAIS LTDA	MAJOR JOSE MOREIRA MATOS	67	GUARULHOS	SP	MAJOR JOSE MOREIRA MATOS 67 GUARULHOS SP 	-234574463	-465687807	07071080	FABRICAÇÃO DE PRODUTOS DIVERSOS
00017027000197	CIAG SORVETES E SOBREMESAS LTDA	SALGADO FILHO	1602	GUARULHOS	SP	SALGADO FILHO 1602 GUARULHOS SP 	-234516095	-465348403	07115000	FABRICAÇÃO DE PRODUTOS ALIMENTÍCIOS
00017089000107	FC/EJC ASSESSORIA E CONSULTORIA EIRELI	BELA CINTRA	1332	SAO PAULO	SP	BELA CINTRA 1332 SAO PAULO SP 	-235576969	-466637547	01415001	ATIVIDADES DE SEDES DE EMPRESAS E DE CONSULTORIA EM GESTÃO EMPRESARIAL
00017120000100	ZEFRAN MATERIAIS PARA CONSTRUCAO LTDA	BRAGANTINA	308	CAMPO LIMPO PAULISTA	SP	BRAGANTINA 308 CAMPO LIMPO PAULISTA SP 	-232097759	-467698613	13232000	COMÉRCIO VAREJISTA
00017201000100	AGRO PECUARIA PAU BRASIL LIMITADA	BR 070	S/N	JUSSARA	GO	BR 070 S/N JUSSARA GO 	-158746612	-508640517	76270000	AGRICULTURA, PECUÁRIA E SERVIÇOS RELACIONADOS
00017226000103	MADASCHI, PERIGO + SOUZA LTDA	FORTALEZA	SN	IBATE	SP	FORTALEZA SN IBATE SP 	-219555496	-479934838	14815000	COMÉRCIO VAREJISTA
00017242000198	C.S.H. - INDUSTRIA E COMERCIO LTDA	COMENDADOR ANTONIO BORIN	2889	JUNDIAI	SP	COMENDADOR ANTONIO BORIN 2889 JUNDIAI SP 	-231751717	-468500176	13218640	ATIVIDADES IMOBILIÁRIAS
00017285000173	PAPELARIA RIO LTDA	SHCSUL CL QUADRA 105 BLOCO B LOJA	24	BRASILIA	DF	SHCSUL CL QUADRA 105 BLOCO B LOJA 24 BRASILIA DF 	-15822241	-47901401	70344520	ATIVIDADES IMOBILIÁRIAS
00017332000189	BLACK BOX DO BRASIL IND E COM LTDA	CECI	6	BARUERI	SP	CECI 6 BARUERI SP 	-234970014	-468298814	06460120	COMÉRCIO VAREJISTA
00017352000150	NAGOYA EDICOES E PRODUCOES MUSICAIS LIMITADA	JOAQUIM FLORIANO	466	SAO PAULO	SP	JOAQUIM FLORIANO 466 SAO PAULO SP 	-235843951	-466750788	04534002	ATIVIDADES ARTÍSTICAS, CRIATIVAS E DE ESPETÁCULOS
00017424000169	GEO SOCIETY COMERCIO E LOCACAO DE MATERIAIS ESPORTIVOS LTDA	FRANCISCO P DE TOLEDO	105	SAO PAULO	SP	FRANCISCO P DE TOLEDO 105 SAO PAULO SP 	-235505199	-4.66333E+15	04185150	COMÉRCIO VAREJISTA
00017544000166	OFSOLUTION SISTEMAS E EQUIPAMENTOS LTDA	DR ELISIO DE CASTRO	434	SAO PAULO	SP	DR ELISIO DE CASTRO 434 SAO PAULO SP 	-235993653	-4.66117E+15	04277010	COMÉRCIO POR ATACADO, EXCETO VEÍCULOS AUTOMOTORES E MOTOCICLETAS
00017545000100	BAR E RESTAURANTE TAINA LTDA	MATEO BEI	1605	SAO PAULO	SP	MATEO BEI 1605 SAO PAULO SP 	-23597093	-46486838	03949011	ALIMENTAÇÃO
00017571000139	ESTUDIO PAULO CAMPOS ARQUITETURA E GESTAO DE OBRAS EIRELI	COTOXO	303	SAO PAULO	SP	COTOXO 303 SAO PAULO SP 	-235302239	-466832013	05021000	SERVIÇOS DE ESCRITÓRIO, DE APOIO ADMINISTRATIVO E OUTROS SERVIÇOS PRESTADOS ÀS EMPRESAS
00017592000154	AUGUSTO E MARIANO ENGENHARIA E SANEAMENTO AMBIENTAL EIRELI	JOAO LOURENCON	7B	VALINHOS	SP	JOAO LOURENCON 7B VALINHOS SP 	-230109666	-470287783	13279011	TRANSPORTE TERRESTRE
00017594000143	SKY LANCHONETE LTDA	PROFESSOR GUSTAVO ENGE	39	CAMPINAS	SP	PROFESSOR GUSTAVO ENGE 39 CAMPINAS SP 	-228946094	-4705509	13024060	COMÉRCIO VAREJISTA
00017614000186	COMERCIAL CAMPESTRE DA SERRA LTDA	SEVERA	1040	SAO PAULO	SP	SEVERA 1040 SAO PAULO SP 	-235118562	-4658871	02111001	FABRICAÇÃO DE PRODUTOS DIVERSOS
00017663000119	FELK MANUSEIO GRAFICO E PROMOCIONAL EIRELI	LUCRECIA BORGES	103	BARUERI	SP	LUCRECIA BORGES 103 BARUERI SP 	-234917721	-468981212	06409160	SERVIÇOS DE ESCRITÓRIO, DE APOIO ADMINISTRATIVO E OUTROS SERVIÇOS PRESTADOS ÀS EMPRESAS
00017690000191	BIG PARTICIPACOES S/A	SANTOS	1293	SAO PAULO	SP	SANTOS 1293 SAO PAULO SP 	-235646482	-466550123	01419904	ATIVIDADES DE SERVIÇOS FINANCEIROS
00017734000183	DRAKA COMTEQ CABOS BRASIL S.A.	DOS BOROROS	2931	JOINVILLE	SC	DOS BOROROS 2931 JOINVILLE SC 	-26252481	-48915897	89239291	FABRICAÇÃO DE MÁQUINAS, APARELHOS E MATERIAIS ELÉTRICOS
00017788000149	NOBRE INDUSTRIA, COMERCIO, IMPORTACAO E EXPORTACAO DE UTENSILIOS DOMESTICOS LTDA	DONA ACHILINA FACHINI	602	ARARAS	SP	DONA ACHILINA FACHINI 602 ARARAS SP 	-223615119	-473719835	13607010	FABRICAÇÃO DE MÁQUINAS, APARELHOS E MATERIAIS ELÉTRICOS
00017797000130	BODEGRAVEN + ROSA DESENVOLVIMENTO DE SISTEMAS LTDA	CORREIA DE LEMOS	318	SAO PAULO	SP	CORREIA DE LEMOS 318 SAO PAULO SP 	-236072554	-466345473	04140000	ATIVIDADES DOS SERVIÇOS DE TECNOLOGIA DA INFORMAÇÃO
00017798000184	FITAL PARTICIPACOES E INVESTIMENTOS LTDA	R 7	1151	GOIANIA	GO	R 7 1151 GOIANIA GO 	-166868982	-492648114	74125120	ATIVIDADES DE SERVIÇOS FINANCEIROS
00017810000150	STAFF LOCACAO RIBEIRAO PRETO LTDA	FLORIANO PEIXOTO	1232	RIBEIRAO PRETO	SP	FLORIANO PEIXOTO 1232 RIBEIRAO PRETO SP 	-211876801	-478083863	14025388	ALUGUÉIS NÃO-IMOBILIÁRIOS E GESTÃO DE ATIVOS INTANGÍVEIS NÃO-FINANCEIROS
00017812000140	MIMASA COMERCIO DE TECIDOS E PLASTICOS LTDA	RANGEL PESTANA	1679	SAO PAULO	SP	RANGEL PESTANA 1679 SAO PAULO SP 	-235440391	-466188542	03001000	COMÉRCIO VAREJISTA
00017814000139	GRAJAU REPRESENTACAO COMERCIAL LTDA	VINHA DEL MAR	12	GOIANIA	GO	VINHA DEL MAR 12 GOIANIA GO 	-166703091	-492203059	74705160	COMÉRCIO POR ATACADO, EXCETO VEÍCULOS AUTOMOTORES E MOTOCICLETAS
00017879000184	RECAPAGEM DE PNEUS DOM PEDRO LTDA	JOSE SELEGA	40	ITATIBA	SP	JOSE SELEGA 40 ITATIBA SP 	-229857234	-468436958	13257593	FABRICAÇÃO DE PRODUTOS DE BORRACHA E DE MATERIAL PLÁSTICO
00017891000199	LIBERTY MOTEL LTDA	MUNICIPAL	33	PIRACICABA	SP	MUNICIPAL 33 PIRACICABA SP 	-226678346	-476574698	13402600	ALOJAMENTO
00017952000118	MOLYGRAFIT INDUSTRIA E COMERCIO LTDA	PERNAMBUCO	178	DIADEMA	SP	PERNAMBUCO 178 DIADEMA SP 	-236776621	-465967879	09941720	FABRICAÇÃO DE COQUE, DE PRODUTOS DERIVADOS DO PETRÓLEO E DE BIOCOMBUSTÍVEIS
00017953000162	LINIC ENGENHARIA LTDA	BARAO DE JACEGUAI	1376	SAO PAULO	SP	BARAO DE JACEGUAI 1376 SAO PAULO SP 	-236190487	-466734971	04606003	CONSTRUÇÃO DE EDIFÍCIOS
00017965000197	R C P R COMERCIAL DE CALCADOS LTDA	SETE DE SETEMBRO	136	SAO JOSE DOS CAMPOS	SP	SETE DE SETEMBRO 136 SAO JOSE DOS CAMPOS SP 	-231816108	-458860556	12210260	COMÉRCIO VAREJISTA
00017987000157	VICENTE ALVES DOS SANTOS JACAREI	DEPUTADO ARNALDO LAURINDO	245	JACAREI	SP	DEPUTADO ARNALDO LAURINDO 245 JACAREI SP 	-232648001	-45964562	12335070	COMÉRCIO VAREJISTA
00018034000103	EDVALDO JOSE BARBOSA	DR RAUL DA ROCHA MEDEIROS	367	MONTE ALTO	SP	DR RAUL DA ROCHA MEDEIROS 367 MONTE ALTO SP 	-212597798	-484864379	15910000	COMÉRCIO VAREJISTA
00018127000138	TOCANTINS TRANSPORTE E TURISMO LTDA	612 SUL, ALAMEDA 4, LOTE 01-A	S/N	PALMAS	TO	612 SUL, ALAMEDA 4, LOTE 01-A S/N PALMAS TO 	-102227752	-483175344	77022100	TRANSPORTE TERRESTRE
00018213000140	DI RENZO COMERCIAL DE PRODUTOS ALIMENTICIOS LTDA	MARIA SERVIDEI DEMARCHI	1361	SAO BERNARDO DO CAMPO	SP	MARIA SERVIDEI DEMARCHI 1361 SAO BERNARDO DO CAMPO SP 	-237361152	-465530407	09820000	COMÉRCIO POR ATACADO, EXCETO VEÍCULOS AUTOMOTORES E MOTOCICLETAS
00018241000168	MAGAZINE DA PESCA LTDA	BERNARDINO VERGUEIRO	109	SAO PAULO	SP	BERNARDINO VERGUEIRO 109 SAO PAULO SP 	-235128395	-465502793	03710060	COMÉRCIO VAREJISTA
00018277000141	SALUSTIANO CALCADOS LTDA	DOUTOR OSWALDO CRUZ	2706	FRANCA	SP	DOUTOR OSWALDO CRUZ 2706 FRANCA SP 	-205224221	-473754362	14401212	COMÉRCIO POR ATACADO, EXCETO VEÍCULOS AUTOMOTORES E MOTOCICLETAS
00018360000110	SAMBEL INDUSTRIA E COMERCIO DE EIXOS LTDA	DAS ANTILHAS	302	BARUERI	SP	DAS ANTILHAS 302 BARUERI SP 	-234966341	-468955637	06409070	FABRICAÇÃO DE VEÍCULOS AUTOMOTORES, REBOQUES E CARROCERIAS
00018404000102	HANKOOK TIRE DO BRASIL SERVICOS DE INTERMEDIACAO DE NEGOCIOS NO RAMO DE PNEUS LTDA	GEORGE OHM	230	SAO PAULO	SP	GEORGE OHM 230 SAO PAULO SP 	-236121265	-466934072	04576020	OUTRAS ATIVIDADES PROFISSIONAIS, CIENTÍFICAS E TÉCNICAS
00018415000192	J H R ZANUTO	CORONEL JOAO LEITE	299	MOGI MIRIM	SP	CORONEL JOAO LEITE 299 MOGI MIRIM SP 	-224348124	-469590155	13800034	COMÉRCIO VAREJISTA
00018421000140	PREMOVALE PROJETOS E CONSTRUCOES - EIRELI	NOSSA SENHORA APARECIDA	1991	CACAPAVA	SP	NOSSA SENHORA APARECIDA 1991 CACAPAVA SP 	-231166492	-4.57048E+15	12295429	CONSTRUÇÃO DE EDIFÍCIOS
00018449000187	TIVOLI EMPREENDIMENTOS TURISTICOS LTDA	PADRE CELESTINO	511	GUARULHOS	SP	PADRE CELESTINO 511 GUARULHOS SP 	-234735886	-465249742	07013100	ALOJAMENTO
00018512000185	MGX SOLUCOES ELETRONICAS LTDA	DO CORREGO	48	SAO PAULO	SP	DO CORREGO 48 SAO PAULO SP 	-235528485	-465464514	03421020	COMÉRCIO POR ATACADO, EXCETO VEÍCULOS AUTOMOTORES E MOTOCICLETAS
00018524000100	ESPACO JACK KINGDOM SERVICOS DE ALIMENTACAO - EIRELI	DOM PEDRO II	3172	SANTO ANDRE	SP	DOM PEDRO II 3172 SANTO ANDRE SP 	-236299226	-46547067	09080001	ALIMENTAÇÃO
00018567000195	FERRANTE + VALLEJO LTDA	RIO DE JANEIRO	1381	AVARE	SP	RIO DE JANEIRO 1381 AVARE SP 	-230998814	-489232542	18700130	COMÉRCIO VAREJISTA
00018575000131	SISMAT - SOLUCOES INTEGRADAS EM SEGURANCA E MEIO AMBIENTE DO TRABALHO LTDA.	CESAR LADEIRA	177	SAO PAULO	SP	CESAR LADEIRA 177 SAO PAULO SP 	-23643556	-467111807	04726040	"SERVIÇOS DE ARQUITETURA E ENGENHARIA
00018675000168	VISUAL SINALIZACAO VIARIA E CONSTRUCOES LTDA	SEBASTIAO LOPES	59	GUARULHOS	SP	SEBASTIAO LOPES 59 GUARULHOS SP 	-234089682	-463815737	07176520	"SERVIÇOS DE ARQUITETURA E ENGENHARIA
00018781000141	JAUPLAST BIRIGUI COMERCIAL E INDUSTRIAL LTDA	MANOEL THEODORO DE SOUZA	59	BIRIGUI	SP	MANOEL THEODORO DE SOUZA 59 BIRIGUI SP 	-212878745	-503358062	16203001	PREPARAÇÃO DE COUROS E FABRICAÇÃO DE ARTEFATOS DE COURO, ARTIGOS PARA VIAGEM E CALÇADOS
00018813000109	LUIS CARLOS MANOEL DA SILVA	CORONEL ANTONIO ABADE	905	LEME	SP	CORONEL ANTONIO ABADE 905 LEME SP 	-221777033	-4.73756E+15	13616308	FABRICAÇÃO DE MÁQUINAS E EQUIPAMENTOS
00018822000108	SERBRAS COMERCIO E PRESTACAO DE SERVICOS HIDRAULICOS LTDA	BOLIVIA	875	RIBEIRAO PRETO	SP	BOLIVIA 875 RIBEIRAO PRETO SP 	-211467648	-477918541	14075250	MANUTENÇÃO, REPARAÇÃO E INSTALAÇÃO DE MÁQUINAS E EQUIPAMENTOS
00018852000106	NOVA ATLANPAPER COMERCIO DE MATERIAIS PLASTICOS LTDA	ANTONIO DO ESPIRITO SANTO	126	SAO ROQUE	SP	ANTONIO DO ESPIRITO SANTO 126 SAO ROQUE SP 	-235510567	-4.71376E+15	18130970	COMÉRCIO POR ATACADO, EXCETO VEÍCULOS AUTOMOTORES E MOTOCICLETAS
00018909000177	ADLES CONFECCOES E COMERCIO LTDA	MAJOR MARCELINO	284	SAO PAULO	SP	MAJOR MARCELINO 284 SAO PAULO SP 	-23533859	-466082178	03025020	CONFECÇÃO DE ARTIGOS DO VESTUÁRIO E ACESSÓRIOS
00018911000146	COMERCIAL DE COUROS PAULISTA LTDA	QS 5 RUA 311	S/N	BRASILIA	DF	QS 5 RUA 311 S/N BRASILIA DF 	-158593821	-480355781	71964180	COMÉRCIO VAREJISTA
00018916000179	TRANSPOMINAS TRANSPORTADORA E REMOCAO DE RESIDUOS LD	AGUA SANTA	42D	SAO PAULO	SP	AGUA SANTA 42D SAO PAULO SP 	-235552117	-465812754	04476490	SERVIÇOS ESPECIALIZADOS PARA CONSTRUÇÃO
00018977000136	M. A. PRADO + CIA LTDA	VISCONDE DO RIO CLARO	121	RIO CLARO	SP	VISCONDE DO RIO CLARO 121 RIO CLARO SP 	-223967668	-475629317	13500270	COMÉRCIO E REPARAÇÃO DE VEÍCULOS AUTOMOTORES E MOTOCICLETAS
00018978000180	IATE CLUBE DE BRASILIA	SCEN TRECHO 02 CONJ 04	SN	BRASILIA	DF	SCEN TRECHO 02 CONJ 04 SN BRASILIA DF 	-158615468	-48001711	70800120	ATIVIDADES ESPORTIVAS E DE RECREAÇÃO E LAZER
00019000000133	JR EMPREENDIMENTOS IMOBILIARIOS LTDA	ENGENHEIRO PORTELA	211	ANAPOLIS	GO	ENGENHEIRO PORTELA 211 ANAPOLIS GO 	-163264209	-489564522	75024100	ATIVIDADES IMOBILIÁRIAS
00019032000139	BLACK HAIR PRODUTOS PARA CABELEIREIROS LTDA	PADRE JOSE DE ANCHIETA	891	SAO PAULO	SP	PADRE JOSE DE ANCHIETA 891 SAO PAULO SP 	-236504079	-467007871	04742001	COMÉRCIO VAREJISTA
00019036000117	SANTA HELENA DO PARAISO MATERIAIS PARA CONSTRUCAO EIRELI	SANTA HELENA	774	GUARULHOS	SP	SANTA HELENA 774 GUARULHOS SP 	-234429718	-464256225	07241270	COMÉRCIO VAREJISTA
00019071000136	ECO ADMINISTRACAO E PARTICIPACOES EIRELI	GUARAREMA	173	SAO PAULO	SP	GUARAREMA 173 SAO PAULO SP 	-236076847	-466261719	04136030	ATIVIDADES DE SERVIÇOS FINANCEIROS
00019128000105	BENEDITO DONIZETI TREVIZANI	FERDINANDO PICHELLI	232	MOGI-GUACU	SP	FERDINANDO PICHELLI 232 MOGI-GUACU SP 	-223463876	-469500152	13845410	COMÉRCIO VAREJISTA
00019143000145	LC RP MADEIREIRA E TRANSPORTADORA EIRELI	MOGIANA	1417	RIBEIRAO PRETO	SP	MOGIANA 1417 RIBEIRAO PRETO SP 	-211462421	-47790533	14075270	COMÉRCIO VAREJISTA
00019162000171	DJB LOGISTICA LTDA	AMADOR BUENO	285	SANTOS	SP	AMADOR BUENO 285 SANTOS SP 	-239367982	-463232361	11013153	TRANSPORTE TERRESTRE
00019209000105	DECAPRI TRANSPORTES LTDA	ANTONIO PATRICIO	100	SAO PAULO	SP	ANTONIO PATRICIO 100 SAO PAULO SP 	-235214042	-466099322	02047060	TRANSPORTE TERRESTRE
00019233000136	AKRON INFORMATICA LTDA	JOSE OSCAR ABREU SAMPAIO	113	SAO PAULO	SP	JOSE OSCAR ABREU SAMPAIO 113 SAO PAULO SP 	-235574768	-465648535	03337020	ATIVIDADES DOS SERVIÇOS DE TECNOLOGIA DA INFORMAÇÃO
00019275000177	MQ MOREIRA QUEIROZ COMERCIO E SERVICOS LTDA	GUARANTA	95	COTIA	SP	GUARANTA 95 COTIA SP 	-23607814	-4.68981E+15	06716240	TRANSPORTE TERRESTRE
00019327000105	COOPERJUD - COOPERATIVA HABITACIONAL DOS FUNCIONARIOS E SERVIDORES DO PODER JUDICIARIO DO ESTADO DE	MINAS GERAIS	519	SAO VICENTE	SP	MINAS GERAIS 519 SAO VICENTE SP 	-239533693	-463680069	11380090	ATIVIDADES DE ORGANIZAÇÕES ASSOCIATIVAS
00019345000197	COMERCIO DE MOVEIS NOSSO LAR LTDA	ALBANO LAZIALE	148	SAO PAULO	SP	ALBANO LAZIALE 148 SAO PAULO SP 	-235581005	-465142296	03574040	COMÉRCIO VAREJISTA
00019357000111	TRENDFOODS LP COMERCIO DE ALIMENTOS LTDA	VERBO DIVINO	663	SAO PAULO	SP	VERBO DIVINO 663 SAO PAULO SP 	-236349389	-467023022	04719001	ALIMENTAÇÃO
00019388000172	BWU COMERCIO E ENTRETENIMENTO S.A.	SACADURA CABRAL	102	RIO DE JANEIRO	RJ	SACADURA CABRAL 102 RIO DE JANEIRO RJ 	-228972387	-431842723	20081902	ALUGUÉIS NÃO-IMOBILIÁRIOS E GESTÃO DE ATIVOS INTANGÍVEIS NÃO-FINANCEIROS
00019389000117	ICB - INTERNATIONAL COMMERCE DO BRASIL REPRESENTACOES LTDA	DONA CHERUBINA VIANA	669	COTIA	SP	DONA CHERUBINA VIANA 669 COTIA SP 	-23591565	-46842576	06708360	COMÉRCIO POR ATACADO, EXCETO VEÍCULOS AUTOMOTORES E MOTOCICLETAS
00019423000153	AJAPEG - MANUTENCAO E REPARACAO DE MAQUINAS - EIRELI	JOAQUIM MOURA DOS SANTOS	386	SUMARE	SP	JOAQUIM MOURA DOS SANTOS 386 SUMARE SP 	-228363615	-471959358	13181570	MANUTENÇÃO, REPARAÇÃO E INSTALAÇÃO DE MÁQUINAS E EQUIPAMENTOS
00019431000108	DUTRA CORRENTES LTDA	DR LAURO CORREA DA SILVA	3155	LIMEIRA	SP	DR LAURO CORREA DA SILVA 3155 LIMEIRA SP 	-225871713	-4.74117E+15	13481631	FABRICAÇÃO DE PRODUTOS DIVERSOS
00019484000110	LIESSI TECNOLOGIA EM USINAGEM LTDA	GUARULHOS	3680	GUARULHOS	SP	GUARULHOS 3680 GUARULHOS SP 	-23497819	-46550973	07030001	FABRICAÇÃO DE PRODUTOS DE METAL, EXCETO MÁQUINAS E EQUIPAMENTOS
00019491000112	GABRILINA COMERCIO DE EMBALAGENS LTDA	ANGELO DUSI	115	SAO BERNARDO DO CAMPO	SP	ANGELO DUSI 115 SAO BERNARDO DO CAMPO SP 	-237068517	-4.65556E+15	09725270	COMÉRCIO VAREJISTA
00019502000164	TECNICON-COMERCIO E SERVICOS LTDA	LUIZ RODRIGUES PEDRO	303	GUARUJA	SP	LUIZ RODRIGUES PEDRO 303 GUARUJA SP 	-239783873	-462249841	11441320	CONSTRUÇÃO DE EDIFÍCIOS
00019512000108	CONTROALL TECNOLOGIA EM AUTOMACAO LTDA	CASA VERDE	2346	SAO PAULO	SP	CASA VERDE 2346 SAO PAULO SP 	-235048234	-466630091	02520200	COMÉRCIO POR ATACADO, EXCETO VEÍCULOS AUTOMOTORES E MOTOCICLETAS
00019517000122	LAMYNA COMERCIO DE FORROS DE PVC LTDA	JOAO ROSSITI	63	RIBEIRAO PRETO	SP	JOAO ROSSITI 63 RIBEIRAO PRETO SP 	-211883931	-478208242	14030030	COMÉRCIO VAREJISTA
00019540000117	EQUIFORMA COMERCIO DE MAQUINAS, APARELHOS, EQUIPAMENTOS METALICOS E SUCATAS EIRELI	CARLOS GOMES	625	CORDEIROPOLIS	SP	CARLOS GOMES 625 CORDEIROPOLIS SP 	-224808499	-474609532	13490000	COMÉRCIO POR ATACADO, EXCETO VEÍCULOS AUTOMOTORES E MOTOCICLETAS
00019564000176	ROMEU ORCIOLI FLORES + CIA LTDA	JOSE MARIA MIRANDA	162	SUMARE	SP	JOSE MARIA MIRANDA 162 SUMARE SP 	-22827768	-472650697	13170001	ALIMENTAÇÃO
00019643000187	DINAMAR - PECAS E SERVICOS MARILIA LTDA	DR THIMO BRUNO BELUCCI	523	MARILIA	SP	DR THIMO BRUNO BELUCCI 523 MARILIA SP 	-221838294	-499633543	17507400	COMÉRCIO E REPARAÇÃO DE VEÍCULOS AUTOMOTORES E MOTOCICLETAS
00019664000100	OSVALDO MIDUOTI	MONSENHOR ALFREDO PEREIRA SAMPAIO	42	SAO PAULO	SP	MONSENHOR ALFREDO PEREIRA SAMPAIO 42 SAO PAULO SP 	-236686585	-466887151	04676010	COMÉRCIO E REPARAÇÃO DE VEÍCULOS AUTOMOTORES E MOTOCICLETAS
00019703000161	VIACAO PLANETA LTDA	QNO 23 AREA ESPECIAL A	SN	BRASILIA	DF	QNO 23 AREA ESPECIAL A SN BRASILIA DF 	-157899229	-481363975	72262300	TRANSPORTE TERRESTRE
00019717000185	CENTER BIRE MODAS LTDA	PRESIDENTE CASTELO BRANCO	269	DIADEMA	SP	PRESIDENTE CASTELO BRANCO 269 DIADEMA SP 	-236870859	-4.66244E+15	09911130	COMÉRCIO VAREJISTA
00019721000143	ALLORA FISIOTERAPIA LTDA	DOMICIANO AREDES	180	DUARTINA	SP	DOMICIANO AREDES 180 DUARTINA SP 	-224160264	-494039314	17470000	ATIVIDADES DE ATENÇÃO À SAÚDE HUMANA
00019739000145	SAVON COMERCIO DE MATERIAIS ORTOPEDICOS E EVENTOS LTDA	DOUTOR EDGARD PEREIRA DE SOUZA	145	CAMPINAS	SP	DOUTOR EDGARD PEREIRA DE SOUZA 145 CAMPINAS SP 	-229448029	-471869093	13058520	COMÉRCIO VAREJISTA
00019761000195	NOEDIR JOSUE FERRARA	CARLOS BONFANTI	10	LEME	SP	CARLOS BONFANTI 10 LEME SP 	-22185104	-473812489	13610238	COMÉRCIO VAREJISTA
00019765000173	JOSE M FELIX CALCADOS	HILDEBRANDO DE LIMA	1395	OSASCO	SP	HILDEBRANDO DE LIMA 1395 OSASCO SP 	-23532159	-4.68046E+15	06190160	COMÉRCIO VAREJISTA
00019766000118	BALDO + BALDO CATANDUVA-COMERCIO DE CORREIAS, MANGUEIRAS E FERRAMENTAS LTDA	MINAS GERAIS	355	CATANDUVA	SP	MINAS GERAIS 355 CATANDUVA SP 	-211375799	-489738907	15801280	COMÉRCIO VAREJISTA
00019855000164	SUPERMERCADO POPULAR TANABI LTDA	ENCARNACAO VERSUTI	83	TANABI	SP	ENCARNACAO VERSUTI 83 TANABI SP 	-206286479	-496546435	15170000	COMÉRCIO VAREJISTA
00019922000140	FORMATO PRODUTOS PROMOCIONAIS LTDA	DESEMBARGADOR AGUIAR VALIM	187	SAO PAULO	SP	DESEMBARGADOR AGUIAR VALIM 187 SAO PAULO SP 	-235914983	-466742491	04535100	COMÉRCIO VAREJISTA
00019931000131	HUTI COMERCIO DE GAS E TRANSPORTADORA LTDA	JAIME TORRES	1091	SAO PAULO	SP	JAIME TORRES 1091 SAO PAULO SP 	-235145262	-465033122	03670000	COMÉRCIO VAREJISTA
00020038000126	MULTICIDADES VIAGENS E TURISMO LTDA	JOSE VERSOLATO	111	SAO BERNARDO DO CAMPO	SP	JOSE VERSOLATO 111 SAO BERNARDO DO CAMPO SP 	-236914873	-46549254	09750730	AGÊNCIAS DE VIAGENS, OPERADORES TURÍSTICOS E SERVIÇOS DE RESERVAS
00020054000119	SUPERMERCADO MONTE CARLO EIRELI	SANTA BARBARA	75	ILHA COMPRIDA	SP	SANTA BARBARA 75 ILHA COMPRIDA SP 	-247499215	-475552378	11925000	COMÉRCIO VAREJISTA
00020059000141	L. M. DESENHOS INDUSTRIAIS LTDA	CHICO DE PAULA	335	SAO PAULO	SP	CHICO DE PAULA 335 SAO PAULO SP 	-234998876	-467011547	02926000	SERVIÇOS DE ESCRITÓRIO, DE APOIO ADMINISTRATIVO E OUTROS SERVIÇOS PRESTADOS ÀS EMPRESAS
00020153000109	RUBBERMATS RETENTORES E AUTOMACAO INDUSTRIAL EIRELI	IPANEMA	2700	SOROCABA	SP	IPANEMA 2700 SOROCABA SP 	-23472081	-474893469	18070631	FABRICAÇÃO DE PRODUTOS DE BORRACHA E DE MATERIAL PLÁSTICO
00020174000116	PRIZER TRANSITARIO E DESPACHOS ADUANEIROS LTDA	PAVAO	367	SAO PAULO	SP	PAVAO 367 SAO PAULO SP 	-236037903	-466713283	04516010	ARMAZENAMENTO E ATIVIDADES AUXILIARES DOS TRANSPORTES
00020224000165	J.G DE JESUS CONSULTORIA EM TRANSPORTES	JAIME FORTE	434	SUZANO	SP	JAIME FORTE 434 SUZANO SP 	-235355519	-463170782	08673180	ARMAZENAMENTO E ATIVIDADES AUXILIARES DOS TRANSPORTES
