TAG	RAZSOC	ENDERECO	COMPL	LOCALIDADE	UF	Full Address	Latitude	Longitude	CEP	U_DESCNAE
00004669000151	LADEIRA E WESSELY ENGENHARIA AUTOMOTIVA LTDA	KENNEDY	164	SAO BERNARDO DO CAMPO	SP	KENNEDY 164 SAO BERNARDO DO CAMPO SP 	-236878263	-465595484	09726250	"SERVIÇOS DE ARQUITETURA E ENGENHARIA
00004693000190	J. P. AMERICO TRANSPORTES E TURISMO LTDA	RUTH PAIVA ZUPPI	62	CAMPINAS	SP	RUTH PAIVA ZUPPI 62 CAMPINAS SP 	-229482421	-4.71796E+15	13058290	TRANSPORTE TERRESTRE
00004700000154	AMT TEXTIL - INDUSTRIA E COMERCIO - EIRELI	LOTUS	105	SAO PAULO	SP	LOTUS 105 SAO PAULO SP 	-235939809	-465428902	03265000	FABRICAÇÃO DE PRODUTOS TÊXTEIS
00004786000115	CARMEL SORVETES LTDA	MIAMI	18	SAO PAULO	SP	MIAMI 18 SAO PAULO SP 	-236117797	-466850497	04564020	COMÉRCIO VAREJISTA
00004788000104	CARTORIO DE REGISTRO DE IMOVEIS, PROTESTOS E TITULOS E DOCUMENTOS	PRESIDENTE KENNEDY	86	JARAGUA	GO	PRESIDENTE KENNEDY 86 JARAGUA GO 	-157576536	-49334069	76330000	ATIVIDADES JURÍDICAS, DE CONTABILIDADE E DE AUDITORIA
00004793000117	LANDO INDUSTRIA E COMERCIO IMPORTACAO E EXPORTACAO LTDA	CAPITAO PACHECO E CHAVES	220	SAO PAULO	SP	CAPITAO PACHECO E CHAVES 220 SAO PAULO SP 	-235819952	-465976947	03126000	FABRICAÇÃO DE PRODUTOS DE METAL, EXCETO MÁQUINAS E EQUIPAMENTOS
00004846000108	CIMPLA COMERCIAL E INDUSTRIAL DO PLANALTO LTDA	SIA/SUL TRECHO 03 LOTES 245/275	S/N	BRASILIA	DF	SIA/SUL TRECHO 03 LOTES 245/275 S/N BRASILIA DF 	-158153261	-479585642	71200030	FABRICAÇÃO DE MÓVEIS
00004938000180	CQN COLINA QUIMICA NACIONAL LTDA	CAJURU	100	PIRACICABA	SP	CAJURU 100 PIRACICABA SP 	-22667988	-4.76238E+15	13413011	FABRICAÇÃO DE PRODUTOS QUÍMICOS
00004978000121	APROCON - ASSOCIACAO DOS PROFISSIONAIS DE CONTABILIDADE DE JATAI	JOAO J O FRANCA	191	JATAI	GO	JOAO J O FRANCA 191 JATAI GO 	-17880229	-517100745	75800011	ATIVIDADES DE ORGANIZAÇÕES ASSOCIATIVAS
00004988000167	E J E OXICORTE LTDA	FERRAZ DE VASCONCELOS	482	ITAQUAQUECETUBA	SP	FERRAZ DE VASCONCELOS 482 ITAQUAQUECETUBA SP 	-234860729	-46372284	08577540	FABRICAÇÃO DE PRODUTOS DE METAL, EXCETO MÁQUINAS E EQUIPAMENTOS
00005001000129	MARIA ROSA VALVERDE LTDA	PEREIRA BARRETO	42	SANTO ANDRE	SP	PEREIRA BARRETO 42 SANTO ANDRE SP 	-236677966	-4.65336E+15	09190210	COMÉRCIO VAREJISTA
00005033000124	CONGREGACAO CRISTA NO BRASIL	DA SAUDADE	107	CAIAPONIA	GO	DA SAUDADE 107 CAIAPONIA GO 	-169523971	-518104209	75850000	ATIVIDADES DE ORGANIZAÇÕES ASSOCIATIVAS
00005058000128	PROVENDE VENDAS E EMPREENDIMENTOS DE IMOVEIS LTDA	SHCS EQ 102/103 BLOCO A LOJA 132 1 PAVIMENTO	S/N	BRASILIA	DF	SHCS EQ 102/103 BLOCO A LOJA 132 1 PAVIMENTO S/N BRASILIA DF 	-158202434	-479045093	70330400	SERVIÇOS ESPECIALIZADOS PARA CONSTRUÇÃO
00005060000105	MIGUEL ROSSI + CIA LTDA	JOAQUIM MOREIRA DA SILVA	2360	JOSE BONIFACIO	SP	JOAQUIM MOREIRA DA SILVA 2360 JOSE BONIFACIO SP 	-21065104	-496775329	15200000	ATIVIDADES IMOBILIÁRIAS
00005063000130	INSTRUVAL INSTRUMENTOS E SERVICOS LTDA	CASTRO ALVES	395	SAO CAETANO DO SUL	SP	CASTRO ALVES 395 SAO CAETANO DO SUL SP 	-23626855	-465722374	09540030	FABRICAÇÃO DE MÁQUINAS E EQUIPAMENTOS
00005087000190	NABAS + CAMARGO LTDA	DE CILLOS	3049	AMERICANA	SP	DE CILLOS 3049 AMERICANA SP 	-22768881	-473440669	13473291	COMÉRCIO VAREJISTA
00005103000144	TRANSVOLTEC ELETRONICA INDUSTRIA E COMERCIO EIRELI	FORTE DOS FRANCESES	274	SAO PAULO	SP	FORTE DOS FRANCESES 274 SAO PAULO SP 	-236034772	-464635645	08340150	FABRICAÇÃO DE EQUIPAMENTOS DE INFORMÁTICA, PRODUTOS ELETRÔNICOS E ÓPTICOS
00005131000161	DSK ADMINISTRADORA PATRIMONIAL EIRELI	ALFREDO IGNACIO NOGUEIRA PENIDO	255	SAO JOSE DOS CAMPOS	SP	ALFREDO IGNACIO NOGUEIRA PENIDO 255 SAO JOSE DOS CAMPOS SP 	-232150591	-459078646	12246000	SERVIÇOS PARA EDIFÍCIOS E ATIVIDADES PAISAGÍSTICAS
00005132000106	SERV. DE REGISTRO DE IMOVEIS, REGISTRO DE TITULOS E DOCUMENTOS, CIVIL DAS PJ E CIVIL DAS PESSOAS NAT	MINISTRO ALFREDO NASSER	1577	FORMOSO	GO	MINISTRO ALFREDO NASSER 1577 FORMOSO GO 	-136537291	-4.88711E+15	76470000	ATIVIDADES JURÍDICAS, DE CONTABILIDADE E DE AUDITORIA
00005135000140	PLM GRAFICA E EDITORA EIRELI	ANTONIO VAZ	241	SAO PAULO	SP	ANTONIO VAZ 241 SAO PAULO SP 	-236656165	-467311323	05818240	IMPRESSÃO E REPRODUÇÃO DE GRAVAÇÕES
00005140000152	SERVICO DE TABELIONATO DE NOTAS E PROTESTOS DE TITULOS, TABELIONATO E OFICIALATO DE CONTRATOS MARITI	MINISTRO ALFREDO NASSER	1577	FORMOSO	GO	MINISTRO ALFREDO NASSER 1577 FORMOSO GO 	-136537291	-4.88711E+15	76470000	ATIVIDADES JURÍDICAS, DE CONTABILIDADE E DE AUDITORIA
00005151000132	HAYARI CONFECCOES LTDA	HAROLDO DALTRO	0576	SAO PAULO	SP	HAROLDO DALTRO 0576 SAO PAULO SP 	-235460908	-465316424	03444000	COMÉRCIO VAREJISTA
00005155000110	KOBECK TRANSPORTES E TERRAPLANAGEM LTDA	SAPOPEMBA	30,5	SAO PAULO	SP	SAPOPEMBA 30,5 SAO PAULO SP 	-23599226	-465156815	08330180	TRANSPORTE TERRESTRE
00005207000159	SINDICATO DOS TRABALHADORES (AS) RURAIS AGRICULTORES E AGRICULTORAS FAMILIARES DE PORANGATU E BONOPO	TIRADENTES	07	PORANGATU	GO	TIRADENTES 07 PORANGATU GO 	-134261187	-491471921	76550000	ATIVIDADES DE ORGANIZAÇÕES ASSOCIATIVAS
00005232000132	NEWMANG INDUSTRIA E COMERCIO DE CONEXOES LIMITADA	CHICO PONTES	1673	SAO PAULO	SP	CHICO PONTES 1673 SAO PAULO SP 	-235097	-4.65969E+15	02067002	FABRICAÇÃO DE MÁQUINAS E EQUIPAMENTOS
00005275000118	CONSTRUTECKMA ENGENHARIA S.A.	PAES DE BARROS	2694	SAO PAULO	SP	PAES DE BARROS 2694 SAO PAULO SP 	-235743005	-4.65877E+15	03149000	SERVIÇOS ESPECIALIZADOS PARA CONSTRUÇÃO
00005281000175	CRAVMAQ COMERCIO DE EQUIPAMENTOS LTDA	ANHANGUERA SP-330 KM 294	S/N	CRAVINHOS	SP	ANHANGUERA SP-330 KM 294 S/N CRAVINHOS SP 	-213399022	-477244445	14140000	COMÉRCIO VAREJISTA
00005325000167	SOUSA + SOUSA COSMETICOS LTDA	DO CROMO	138	SANTA BARBARA D:OESTE	SP	DO CROMO 138 SANTA BARBARA D:OESTE SP 	-227547476	-473620518	13456415	COMÉRCIO VAREJISTA
00005332000169	ALTO ASTRAL CONSTRUTORA E INCORPORADORA LTDA	BRASIL	600	PRAIA GRANDE	SP	BRASIL 600 PRAIA GRANDE SP 	-240199131	-464920801	11701090	CONSTRUÇÃO DE EDIFÍCIOS
00005344000193	JOSE RAMON CAVALCANTE	SAO JOAO	1588	SAO PAULO	SP	SAO JOAO 1588 SAO PAULO SP 	-235377618	-46647953	01211000	COMÉRCIO VAREJISTA
00005366000153	AGRY PRODUTOS E SERVICOS PARA PECUARIA LTDA	TIRADENTES	848	PIRACICABA	SP	TIRADENTES 848 PIRACICABA SP 	-227227922	-4.76519E+15	13400760	COMÉRCIO POR ATACADO, EXCETO VEÍCULOS AUTOMOTORES E MOTOCICLETAS
00005373000155	RHOWERT INDUSTRIA E COMERCIO LTDA	EMIR MACEDO NOGUEIRA (JD RUYCE)	164	DIADEMA	SP	EMIR MACEDO NOGUEIRA (JD RUYCE) 164 DIADEMA SP 	-237137904	-46602525	09961720	FABRICAÇÃO DE PRODUTOS DE METAL, EXCETO MÁQUINAS E EQUIPAMENTOS
00005391000137	EZIO PIRES EIRELI	MAJOR NICACIO	3041	FRANCA	SP	MAJOR NICACIO 3041 FRANCA SP 	-205416839	-4.73872E+15	14403462	COMÉRCIO VAREJISTA
00005430000104	EDUARDO GUERRA HORTIFRUTI	SANTA CRESCENCIA	236	SAO PAULO	SP	SANTA CRESCENCIA 236 SAO PAULO SP 	-235987051	-46743703	05524020	COMÉRCIO POR ATACADO, EXCETO VEÍCULOS AUTOMOTORES E MOTOCICLETAS
00005478000104	SIZELMAX BENEFICIAMENTO DE PECAS EIRELI	PAU DO CAFE	287	DIADEMA	SP	PAU DO CAFE 287 DIADEMA SP 	-237058241	-466041999	09961040	FABRICAÇÃO DE PRODUTOS DE METAL, EXCETO MÁQUINAS E EQUIPAMENTOS
00005484000161	MERCATEL ADMINISTRACAO E ASSESSORIA EMPRESARIAL LTDA	SANTA CRUZ	722	SAO PAULO	SP	SANTA CRUZ 722 SAO PAULO SP 	-235977026	-46629622	04122000	ATIVIDADES IMOBILIÁRIAS
00005538000199	ABRIGO SAO FRANCISCO DE ASSIS	11 ESQUINA COM RUA VERA CRUZ	SN	CALDAS NOVAS	GO	11 ESQUINA COM RUA VERA CRUZ SN CALDAS NOVAS GO 	-17748579	-486263371	75690000	ATIVIDADES DE ORGANIZAÇÕES ASSOCIATIVAS
00005561000183	SINDICATO RURAL DE MORRINHOS	1	S/N	MORRINHOS	GO	1 S/N MORRINHOS GO 	-177291366	-491247265	75650000	ATIVIDADES DE ORGANIZAÇÕES ASSOCIATIVAS
00005595000178	SINDICATO DOS TRABALHADORES RURAIS AGRICULTORES E AGRICULTORAS FAMILIARES DE PONTALINA CROMINIA MAIR	ONOFRE DE ANDRADE	332	PONTALINA	GO	ONOFRE DE ANDRADE 332 PONTALINA GO 	-175255767	-494498132	75620000	ATIVIDADES DE ORGANIZAÇÕES ASSOCIATIVAS
00005598000101	CONEMAX DO BRASIL INDUSTRIA E COMERCIO DE CONEXOES LTDA	GANGES	635	SAO PAULO	SP	GANGES 635 SAO PAULO SP 	-235463527	-465307611	03445030	METALURGIA
00005599000156	MILENIO COMERCIO, LOCACAO E SERVICOS LTDA	BRIGADEIRO FARIA LIMA	2369	SAO PAULO	SP	BRIGADEIRO FARIA LIMA 2369 SAO PAULO SP 	-235772915	-466862587	01452000	SERVIÇOS ESPECIALIZADOS PARA CONSTRUÇÃO
00005644000172	RIGEL COMERCIO DE INFORMATICA EIRELI	ANTONIO RAPOSO	186	SAO PAULO	SP	ANTONIO RAPOSO 186 SAO PAULO SP 	-235209091	-4.67065E+15	05074020	COMÉRCIO POR ATACADO, EXCETO VEÍCULOS AUTOMOTORES E MOTOCICLETAS
00005645000117	CENTRO DE RECUPERACAO DO ALCOOLATRA	BAHIA	38	PONTALINA	GO	BAHIA 38 PONTALINA GO 	-175176806	-494559146	75620000	ATIVIDADES DE ORGANIZAÇÕES ASSOCIATIVAS
00005661000100	ACO-FRAN COMERCIO DE ACO E MATERIAIS DE CONSTRUCAO LTDA	RAPOSO TAVARES	SN	ASSIS	SP	RAPOSO TAVARES SN ASSIS SP 	-22635317	-504008316	19811000	SERVIÇOS ESPECIALIZADOS PARA CONSTRUÇÃO
00005674000189	SOUTH AMERICAN NATION COMERCIO IMPORTACAO EXPORTACAO LTDA	24 DE MAIO	77	SAO PAULO	SP	24 DE MAIO 77 SAO PAULO SP 	-235446565	-466395358	01041001	COMÉRCIO POR ATACADO, EXCETO VEÍCULOS AUTOMOTORES E MOTOCICLETAS
00005678000167	CALDAS ESPORTE CLUBE - CEC	MACHADO DE ASSIS	325	CALDAS NOVAS	GO	MACHADO DE ASSIS 325 CALDAS NOVAS GO 	-177449421	-486293861	75690000	ATIVIDADES ESPORTIVAS E DE RECREAÇÃO E LAZER
00005730000185	FAT BALLOON COMERCIO LTDA	FAUSTINO PEREIRA MATIAS	59	SAO PAULO	SP	FAUSTINO PEREIRA MATIAS 59 SAO PAULO SP 	-235093544	-466268442	02012090	COMÉRCIO VAREJISTA
00005785000195	GRUPO ASSISTENCIAL ADOLFO BEZERRA DE MENEZES	AVENIDAS 05/06	S/N	LUZIANIA	GO	AVENIDAS 05/06 S/N LUZIANIA GO 	-165236174	-480010282	72817180	ATIVIDADES DE ORGANIZAÇÕES ASSOCIATIVAS
00005787000184	AGRIS - EMBALAGENS INDUSTRIA E COMERCIO LTDA	MANOEL DA NOBREGA (PRQ S SETEMBRO)	598	DIADEMA	SP	MANOEL DA NOBREGA (PRQ S SETEMBRO) 598 DIADEMA SP 	-236927184	-466237281	09910720	FABRICAÇÃO DE PRODUTOS DE BORRACHA E DE MATERIAL PLÁSTICO
00005809000106	FERRAGENS NAGAHAMA LTDA	HAROLDO DALTRO	38	SAO PAULO	SP	HAROLDO DALTRO 38 SAO PAULO SP 	-235491114	-465334918	03444090	COMÉRCIO VAREJISTA
00005811000185	ROQUE + SOARES LTDA	SIQUEIRA CAMPOS	705	BERNARDINO DE CAMPOS	SP	SIQUEIRA CAMPOS 705 BERNARDINO DE CAMPOS SP 	-2301951	-4.94759E+15	18960000	COMÉRCIO E REPARAÇÃO DE VEÍCULOS AUTOMOTORES E MOTOCICLETAS
00005817000152	DISTRIBUIDORA DE GAS SANTOS + SANTOS LTDA	DOM PEDRO I	380	FRANCISCO MORATO	SP	DOM PEDRO I 380 FRANCISCO MORATO SP 	-232911747	-467527008	07912000	COMÉRCIO VAREJISTA
00005855000105	ALFA GERMANOS COMERCIAL LTDA	TUTOIA	224	SAO PAULO	SP	TUTOIA 224 SAO PAULO SP 	-2357349	-466519195	04007000	ATIVIDADES IMOBILIÁRIAS
00005858000149	ITABERABA POINT SUPER LANCHES LTDA	ITABERABA	5015	SAO PAULO	SP	ITABERABA 5015 SAO PAULO SP 	-234740696	-466703219	02739000	ALIMENTAÇÃO
00005889000108	C DO NASCIMENTO PRODUTOS DE LIMPEZA	JACINTHO PEREIRA	742	SAO PAULO	SP	JACINTHO PEREIRA 742 SAO PAULO SP 	-234511611	-467286412	02992130	COMÉRCIO VAREJISTA
00005892000113	M L SOUZA + CIA LTDA	C 6	S/N	BRASILIA	DF	C 6 S/N BRASILIA DF 	-157786532	-4.79942E+15	72010060	COMÉRCIO VAREJISTA
00005931000182	PADARIA TRES IRMAOS DE SOROCABA LTDA	JORGE MARTHE	241	SOROCABA	SP	JORGE MARTHE 241 SOROCABA SP 	-234944481	-47497487	18055800	FABRICAÇÃO DE PRODUTOS ALIMENTÍCIOS
00005937000150	QUATTRU INDUSTRIA DE PECAS AUTOMOTIVAS LTDA	LUCIA MORMITO BIASON	106	MAUA	SP	LUCIA MORMITO BIASON 106 MAUA SP 	-237024978	-464712234	09370835	FABRICAÇÃO DE VEÍCULOS AUTOMOTORES, REBOQUES E CARROCERIAS
00005946000140	NOVA FORT FRIOS COMERCIO DE GENEROS ALIMENTICIOS LTDA	ANTONIO BONES	95	SAO PAULO	SP	ANTONIO BONES 95 SAO PAULO SP 	-23569111	-467465427	05360210	COMÉRCIO POR ATACADO, EXCETO VEÍCULOS AUTOMOTORES E MOTOCICLETAS
00005949000184	EDITORA E DISTRIBUIDORA SUPLEGRAF LTDA	GENERAL DE SOUZA NETO	150	SAO PAULO	SP	GENERAL DE SOUZA NETO 150 SAO PAULO SP 	-235356596	-465459229	03502020	EDIÇÃO E EDIÇÃO INTEGRADA À IMPRESSÃO
00006010000134	ONE DISTRIBUIDORA DE MEDICAMENTOS EIRELI EM RECUPERACAO JUDICIAL	SANTA HELENA	112	VARGEM GRANDE PAULISTA	SP	SANTA HELENA 112 VARGEM GRANDE PAULISTA SP 	-23649584	-46994371	06730000	COMÉRCIO POR ATACADO, EXCETO VEÍCULOS AUTOMOTORES E MOTOCICLETAS
00006027000191	SERQUIMICA INDUSTRIA, COMERCIO, IMPORTACAO E EXPORTACAO DE PRODUTOS QUIMICOS LTDA.	ARCANGELO MAGRO	587	SERTAOZINHO	SP	ARCANGELO MAGRO 587 SERTAOZINHO SP 	-211481531	-480108306	14175340	FABRICAÇÃO DE PRODUTOS QUÍMICOS
00006060000111	S M VASQUEZ REPRESENTACOES COMERCIAIS LTDA	VIRGINIA BERDAGUE TEIXEIRA	160	SAO BERNARDO DO CAMPO	SP	VIRGINIA BERDAGUE TEIXEIRA 160 SAO BERNARDO DO CAMPO SP 	-237539029	-466307653	09852570	COMÉRCIO POR ATACADO, EXCETO VEÍCULOS AUTOMOTORES E MOTOCICLETAS
00006192000143	EDSON DANIEL PONTES SUPERMERCADO EIRELI	20 DE AGOSTO	901	TAMBAU	SP	20 DE AGOSTO 901 TAMBAU SP 	-217033764	-472708035	13710000	COMÉRCIO VAREJISTA
00006205000184	IGREJA BATISTA DE CRISTALANDIA	DOM JAIME ANTONIO SCHUCK	1379	CRISTALANDIA	TO	DOM JAIME ANTONIO SCHUCK 1379 CRISTALANDIA TO 	-105996569	-491948864	77490000	ATIVIDADES DE ORGANIZAÇÕES ASSOCIATIVAS
00006221000177	SINDICATO REGIONAL DOS TRABALHADORES E TRABALHADORAS RURAIS DE PORTO NACIONAL	DOM PEDRO I	331	PORTO NACIONAL	TO	DOM PEDRO I 331 PORTO NACIONAL TO 	-107122575	-4.84111E+15	77500000	ATIVIDADES DE ORGANIZAÇÕES ASSOCIATIVAS
00006263000108	HARIPAX GROUP INVESTIMENTOS E PARTICIPACOES LTDA.	JAPAO	484	SANTANA DE PARNAIBA	SP	JAPAO 484 SANTANA DE PARNAIBA SP 	-234464566	-46928797	06502345	ATIVIDADES DE SERVIÇOS FINANCEIROS
00006276000187	SEGAUT SEGURANCA ELETRONICA E AUTOMACAO LTDA	JOAO GODOY	551	RIBEIRAO PRETO	SP	JOAO GODOY 551 RIBEIRAO PRETO SP 	-21193772	-478034057	14020230	COMÉRCIO POR ATACADO, EXCETO VEÍCULOS AUTOMOTORES E MOTOCICLETAS
00006296000158	SANTA CRUZ DE GOIAS CARTORIO DO PRIMEIRO OFICIO	JULIAO	SN	SANTA CRUZ DE GOIAS	GO	JULIAO SN SANTA CRUZ DE GOIAS GO 	-173943798	-48598804	75220000	ATIVIDADES JURÍDICAS, DE CONTABILIDADE E DE AUDITORIA
00006298000147	O.H.M. COMERCIO DE MATERIAIS HIDRAULICOS E ELETRICOS LTDA	NOVA INDEPENDENCIA	333	SAO PAULO	SP	NOVA INDEPENDENCIA 333 SAO PAULO SP 	-236051686	-4.66917E+15	04570000	COMÉRCIO VAREJISTA
00006379000147	CHURRASCARIA DO LAGO AGUAS CLARAS LTDA	ASSIS CHATEAUBRIAND	S/N	LUZIANIA	GO	ASSIS CHATEAUBRIAND S/N LUZIANIA GO 	-162501267	-479436089	72812030	ALIMENTAÇÃO
00006391000151	YOSHIZAKI IRRIGACAO LTDA	CAPITAO MORAES	412	PIEDADE	SP	CAPITAO MORAES 412 PIEDADE SP 	-237185113	-47414361	18170000	FABRICAÇÃO DE MÁQUINAS E EQUIPAMENTOS
00006440000156	J. MUNHOZ REPRESENTACAO, CONSULTORIA E CORRETAGEM LTDA	MARANHAO	982	SAO CAETANO DO SUL	SP	MARANHAO 982 SAO CAETANO DO SUL SP 	-236212367	-465635856	09541001	COMÉRCIO POR ATACADO, EXCETO VEÍCULOS AUTOMOTORES E MOTOCICLETAS
00006449000167	NEUROGRAFF ELETROMEDICINA EIRELI	ROSA DO CAMPO	422	SAO PAULO	SP	ROSA DO CAMPO 422 SAO PAULO SP 	-235008105	-464629179	08061040	MANUTENÇÃO, REPARAÇÃO E INSTALAÇÃO DE MÁQUINAS E EQUIPAMENTOS
00006480000106	JOAQUIM CARLOS DA SILVA RANCHARIA	DOM PEDRO II	920	RANCHARIA	SP	DOM PEDRO II 920 RANCHARIA SP 	-222293318	-5.08924E+15	19600000	COMÉRCIO VAREJISTA
00006616000170	4 QUATROS INFORMATICA LTDA	LOURENCO NUNES	214	SAO PAULO	SP	LOURENCO NUNES 214 SAO PAULO SP 	-236682989	-46665153	04401150	ATIVIDADES DOS SERVIÇOS DE TECNOLOGIA DA INFORMAÇÃO
00006629000149	PONTO EXPRESS ENCOMENDAS EIRELI	SAMPAIO CORREA	167	SAO PAULO	SP	SAMPAIO CORREA 167 SAO PAULO SP 	-235100151	-466751168	02710080	CORREIO E OUTRAS ATIVIDADES DE ENTREGA
00006638000130	R + A COMERCIO DE MAQUINAS LTDA	BERNARDINO FANGANIELLO	734	SAO PAULO	SP	BERNARDINO FANGANIELLO 734 SAO PAULO SP 	-23512383	-46663009	02512000	COMÉRCIO VAREJISTA
00006688000117	MICROMEC MICRO MECANICA LTDA	AMIN ESPER	195	JACAREI	SP	AMIN ESPER 195 JACAREI SP 	-233018781	-459697779	12327699	COMÉRCIO VAREJISTA
00006734000188	SINDICATO RURAL DE RIO VERDE	72	345	RIO VERDE	GO	72 345 RIO VERDE GO 	-177809269	-509184236	75903270	ATIVIDADES DE ORGANIZAÇÕES ASSOCIATIVAS
00006777000163	CECILIA FRIDLIN	JOSE PAULINO	226	SAO PAULO	SP	JOSE PAULINO 226 SAO PAULO SP 	-235320246	-466382693	01120000	COMÉRCIO VAREJISTA
00006811000108	ITALFILTER COMERCIO E DISTRIBUICAO LTDA	ARARAQUARA	380	SOROCABA	SP	ARARAQUARA 380 SOROCABA SP 	-234711442	-474368268	18085470	COMÉRCIO E REPARAÇÃO DE VEÍCULOS AUTOMOTORES E MOTOCICLETAS
00006817000177	A FESTIVA CONFEITOS E ORNAMENTACOES LTDA	SHC/SUL CR QUADRA 506 BLOCO C LOJA 15 E NR: 14 PELA W/2	S/N	BRASILIA	DF	SHC/SUL CR QUADRA 506 BLOCO C LOJA 15 E NR: 14 PELA W/2 S/N BRASILIA DF 	-158271753	-479101552	70350535	COMÉRCIO VAREJISTA
00006833000160	ASSOCIACAO DOS ZOOTECNISTAS DO ESTADO DE GOIAS	UNIVERSITARIA	S/N	GOIANIA	GO	UNIVERSITARIA S/N GOIANIA GO 	-166760617	-492448499	74605010	ATIVIDADES DE ORGANIZAÇÕES ASSOCIATIVAS
00006874000156	MUNICIPIO DE NOVO BRASIL	DEGIR MIRANDA TELES	S/N	NOVO BRASIL	GO	DEGIR MIRANDA TELES S/N NOVO BRASIL GO 	-16031772	-50711737	76285000	ADMINISTRAÇÃO PÚBLICA, DEFESA E SEGURIDADE SOCIAL
00006879000189	COMPACTA COMERCIO E SERVICOS LTDA	AZIR ANTONIO SALTON	299	SAO PAULO	SP	AZIR ANTONIO SALTON 299 SAO PAULO SP 	-235002622	-466112575	02046010	COMÉRCIO VAREJISTA
00006882000100	CARVALHO + CARVALHO LTDA	CLS 311 BLOCO A	SN	BRASILIA	DF	CLS 311 BLOCO A SN BRASILIA DF 	-15819516	-47912121	70364510	COMÉRCIO VAREJISTA
00006910000181	NILSON DA CRUZ	JOSE BENEDICTO DE CAMPOS	140	TREMEMBE	SP	JOSE BENEDICTO DE CAMPOS 140 TREMEMBE SP 	-229744696	-4.55502E+15	12120000	SELEÇÃO, AGENCIAMENTO E LOCAÇÃO DE MÃO-DE-OBRA
00006956000109	GUARU - SAT COMERCIO E CONSERTOS LTDA	PAPA JOAO PAULO I	3939	GUARULHOS	SP	PAPA JOAO PAULO I 3939 GUARULHOS SP 	-23425779	-46430167	07174000	REPARAÇÃO E MANUTENÇÃO DE EQUIPAMENTOS DE INFORMÁTICA E COMUNICAÇÃO E DE OBJETOS PESSOAIS E DOMÉSTICOS
00007028000150	BONI-BAURU COMERCIO E REPRESENTACOES LTDA	PROFESSOR JOSE RANIERI	8-60	BAURU	SP	PROFESSOR JOSE RANIERI 8-60 BAURU SP 	-223277274	-490655306	17015361	COMÉRCIO POR ATACADO, EXCETO VEÍCULOS AUTOMOTORES E MOTOCICLETAS
00007029000103	JLM ADMINISTRACAO LTDA.	BRIGADEIRO FARIA LIMA	1234	SAO PAULO	SP	BRIGADEIRO FARIA LIMA 1234 SAO PAULO SP 	-235688617	-466924886	01451001	ATIVIDADES DE SERVIÇOS FINANCEIROS
00007088000173	SERVICO AUTONOMO DE AGUA E ESGOTO	BETEL	1173	ANANAS	TO	BETEL 1173 ANANAS TO 	-627541	-481597946	77890000	ADMINISTRAÇÃO PÚBLICA, DEFESA E SEGURIDADE SOCIAL
00007138000112	MITRA DIOCESANA DE TOCANTINOPOLIS	15 DE NOVEMBRO	245	TOCANTINOPOLIS	TO	15 DE NOVEMBRO 245 TOCANTINOPOLIS TO 	-6.32894E+15	-4.74166E+15	77900000	ATIVIDADES DE ORGANIZAÇÕES ASSOCIATIVAS
00007141000136	TRANS-HENFER TRANSPORTES DE CARGAS LTDA	JOAO SANTAROSA	75	AMERICANA	SP	JOAO SANTAROSA 75 AMERICANA SP 	-227392512	-473017477	13477590	TRANSPORTE TERRESTRE
00007153000160	SEMUSA - SERVICO MUNICIPAL DE SANEAMENTO	13 DE OUTUBRO	737	ARAGUATINS	TO	13 DE OUTUBRO 737 ARAGUATINS TO 	-56492435	-481250566	77950000	CAPTAÇÃO, TRATAMENTO E DISTRIBUIÇÃO DE ÁGUA
00007177000110	POLI DESIGN PROJETOS PROMOCOES E EMPREENDIMENTOS LTDA.	AUGUSTO FRANCISCHINELLI	239	ITU	SP	AUGUSTO FRANCISCHINELLI 239 ITU SP 	-232656167	-473174714	13311610	SERVIÇOS DE ESCRITÓRIO, DE APOIO ADMINISTRATIVO E OUTROS SERVIÇOS PRESTADOS ÀS EMPRESAS
00007202000165	JOAO VIEIRA DOS SANTOS MARCENARIA	RIBEIRAO PONTE BAIXA	2A	SAO PAULO	SP	RIBEIRAO PONTE BAIXA 2A SAO PAULO SP 	-236827804	-46757374	04932160	MANUTENÇÃO, REPARAÇÃO E INSTALAÇÃO DE MÁQUINAS E EQUIPAMENTOS
00007214000190	CENTRIK ELETRODOMESTICOS LTDA.	DOM PEDRO I	884	DIADEMA	SP	DOM PEDRO I 884 DIADEMA SP 	-236950131	-466126414	09991000	FABRICAÇÃO DE PRODUTOS DE BORRACHA E DE MATERIAL PLÁSTICO
00007274000102	DS TRANSPORTES EIRELI	OURINHOS	117	TABOAO DA SERRA	SP	OURINHOS 117 TABOAO DA SERRA SP 	-236235496	-467778072	06765290	TRANSPORTE TERRESTRE
00007283000101	RECHETTI + RENESTO LTDA	PAULISTA	207	AMERICANA	SP	PAULISTA 207 AMERICANA SP 	-227379149	-473231733	13478580	COMÉRCIO E REPARAÇÃO DE VEÍCULOS AUTOMOTORES E MOTOCICLETAS
00007297000117	CICONCORT COMERCIO DE FERRAMENTAS LTDA.	BRESSER	731	SAO PAULO	SP	BRESSER 731 SAO PAULO SP 	-235366214	-46609057	03017000	COMÉRCIO POR ATACADO, EXCETO VEÍCULOS AUTOMOTORES E MOTOCICLETAS
00007330000109	FLADIS DISTRIBUIDORA DE AGUAS LTDA	ALFREDO BERNARDO LEITE	271	SAO BERNARDO DO CAMPO	SP	ALFREDO BERNARDO LEITE 271 SAO BERNARDO DO CAMPO SP 	-236600539	-466026045	09670000	ARMAZENAMENTO E ATIVIDADES AUXILIARES DOS TRANSPORTES
00007352000179	JOSE JUVENAL DOS SANTOS GUARULHOS	MENA	451	GUARULHOS	SP	MENA 451 GUARULHOS SP 	-234481815	-465405582	07097001	MANUTENÇÃO, REPARAÇÃO E INSTALAÇÃO DE MÁQUINAS E EQUIPAMENTOS
00007401000173	MUNICIPIO DE PALMEIROPOLIS	12	224	PALMEIROPOLIS	TO	12 224 PALMEIROPOLIS TO 	-130424424	-48407425	77365000	ADMINISTRAÇÃO PÚBLICA, DEFESA E SEGURIDADE SOCIAL
00007449000181	FABIANA RUGA COSMETICOS EIRELI	BARAO DE MONTE SANTO	1195	MOCOCA	SP	BARAO DE MONTE SANTO 1195 MOCOCA SP 	-21466814	-470002389	13735060	COMÉRCIO VAREJISTA
00007450000106	ADVOCACIA WALDOMIRO DE AZEVEDO FERREIRA SC	1.128	207	GOIANIA	GO	1.128 207 GOIANIA GO 	-166868982	-492648114	74175130	ATIVIDADES JURÍDICAS, DE CONTABILIDADE E DE AUDITORIA
00007461000196	INSTAFIBRA INDUSTRIA COMERCIO E INSTALACOES LTDA	OLAVIO VERGILIO DOS SANTOS	145	SAO PAULO	SP	OLAVIO VERGILIO DOS SANTOS 145 SAO PAULO SP 	-236874597	-466983661	04775220	FABRICAÇÃO DE PRODUTOS DE BORRACHA E DE MATERIAL PLÁSTICO
00007484000109	PRIMEIRA IGREJA BATISTA EM URUACU	01	33	URUACU	GO	01 33 URUACU GO 	-145246488	-491468996	76400000	ATIVIDADES DE ORGANIZAÇÕES ASSOCIATIVAS
00007500000155	SINDICATO DOS TRABALHADORES NAS INDUSTRIAS EXTRATIVAS E BENEFICIAMENTO DE MINACU GO E REGIAO	MATO GROSSO	1631	MINACU	GO	MATO GROSSO 1631 MINACU GO 	-135285893	-482160528	76450000	ATIVIDADES DE ORGANIZAÇÕES ASSOCIATIVAS
00007506000122	MPL PARTICIPACOES LTDA	DAS NACOES UNIDAS	11633	SAO PAULO	SP	DAS NACOES UNIDAS 11633 SAO PAULO SP 	-236020967	-466949952	04578000	ATIVIDADES DE SERVIÇOS FINANCEIROS
00007528000192	ACESSORY TEXTIL LTDA	CORREIA DE MELO	84	SAO PAULO	SP	CORREIA DE MELO 84 SAO PAULO SP 	-23530373	-466375433	01123020	SERVIÇOS DE ESCRITÓRIO, DE APOIO ADMINISTRATIVO E OUTROS SERVIÇOS PRESTADOS ÀS EMPRESAS
00007612000106	PROINTHEL CONSTRUTORA - EIRELI	TILAPIA	555	SANTANA DE PARNAIBA	SP	TILAPIA 555 SANTANA DE PARNAIBA SP 	-234530788	-468840499	06540355	CONSTRUÇÃO DE EDIFÍCIOS
00007618000183	SERVICOS + INSTALACOES ALVES LTDA	JANUARIO DOS SANTOS	65	SAO PAULO	SP	JANUARIO DOS SANTOS 65 SAO PAULO SP 	-234760749	-467049676	02978010	COMÉRCIO VAREJISTA
00007621000105	DS - INDUSTRIA E COMERCIO DE JOIAS LTDA	MARECHAL ARTHUR DA COSTA E SILVA	294	LIMEIRA	SP	MARECHAL ARTHUR DA COSTA E SILVA 294 LIMEIRA SP 	-225838217	-473840046	13487230	FABRICAÇÃO DE PRODUTOS DIVERSOS
00007666000171	CARTORIO REG IMOV P JURID TITULOS DOC PROT TAB NOTAS	04 QUADRA 19 LOTE 08	SN	CAMPINACU	GO	04 QUADRA 19 LOTE 08 SN CAMPINACU GO 	-137875297	-485677409	76440000	ATIVIDADES JURÍDICAS, DE CONTABILIDADE E DE AUDITORIA
00007762000110	C C R ENGENHARIA LTDA	ANTONIO DE OLIVEIRA	585	SAO PAULO	SP	ANTONIO DE OLIVEIRA 585 SAO PAULO SP 	-236277348	-467042835	04718050	CONSTRUÇÃO DE EDIFÍCIOS
00007805000167	DI-LAGO COMERCIO E REPRESENTACAO DE PRODUTOS ALIMENTICIOS EM GERAL LTDA	TANQUINHO	253	SAO PAULO	SP	TANQUINHO 253 SAO PAULO SP 	-23532922	-465769418	03080040	COMÉRCIO POR ATACADO, EXCETO VEÍCULOS AUTOMOTORES E MOTOCICLETAS
00007881000172	MANIAX SERVICOS SOCIEDADE SIMPLES LTDA	PORTO MARTINS	773	SAO PAULO	SP	PORTO MARTINS 773 SAO PAULO SP 	-236000865	-466867519	04570140	SERVIÇOS DE ESCRITÓRIO, DE APOIO ADMINISTRATIVO E OUTROS SERVIÇOS PRESTADOS ÀS EMPRESAS
00007883000161	JOSE DIAS MOREIRA GUAPIARA	VITALINO PAGLIATO	460	GUAPIARA	SP	VITALINO PAGLIATO 460 GUAPIARA SP 	-241896991	-485300136	18310000	COMÉRCIO VAREJISTA
00007897000185	SYNCHRO SYSTEMS CONSULTORIA DE INFORMATICA S/C LTDA	JOSE ESTEVES CARRAMENHA	109	SAO PAULO	SP	JOSE ESTEVES CARRAMENHA 109 SAO PAULO SP 	-236004602	-46732207	05625120	ATIVIDADES DOS SERVIÇOS DE TECNOLOGIA DA INFORMAÇÃO
00007910000104	GROWER ENGENHARIA E DESENVOLVIMENTO DE NEGOCIOS LTDA	ITAPIMIRUM	690	SAO PAULO	SP	ITAPIMIRUM 690 SAO PAULO SP 	-236313058	-467335465	05716090	COMÉRCIO POR ATACADO, EXCETO VEÍCULOS AUTOMOTORES E MOTOCICLETAS
00007913000130	REORDER INFORMATICA LTDA	OLGA	422	SAO PAULO	SP	OLGA 422 SAO PAULO SP 	-235297023	-466641534	01155040	ATIVIDADES DOS SERVIÇOS DE TECNOLOGIA DA INFORMAÇÃO
00007914000184	MUNICIPIO DE ARENOPOLIS	GABRIEL RAIMUNDO DE SOUSA	555	ARENOPOLIS	GO	GABRIEL RAIMUNDO DE SOUSA 555 ARENOPOLIS GO 	-163880014	-515586029	76235000	ADMINISTRAÇÃO PÚBLICA, DEFESA E SEGURIDADE SOCIAL
00007940000102	TALENTU:S MOVEIS LTDA	FERES CURY	275	VOTUPORANGA	SP	FERES CURY 275 VOTUPORANGA SP 	-20407949	-499964491	15507005	FABRICAÇÃO DE MÓVEIS
00008010000173	QUINTAS CASTALDI ENGENHARIA LTDA	ANA COSTA	471	SANTOS	SP	ANA COSTA 471 SANTOS SP 	-239651376	-463324296	11060003	CONSTRUÇÃO DE EDIFÍCIOS
00008025000131	WORKS CONSTRUCOES E COMERCIO LTDA	FRANCISCO BUENO	143	NOVA ODESSA	SP	FRANCISCO BUENO 143 NOVA ODESSA SP 	-227786133	-4.73031E+15	13460000	COMÉRCIO VAREJISTA
00008058000181	TAKANO SERVICOS DE DEDETIZACAO E DESENTUPIMENTO EIRELI	LIMBANI	117	SAO PAULO	SP	LIMBANI 117 SAO PAULO SP 	-236520755	-467737267	05796110	SERVIÇOS PARA EDIFÍCIOS E ATIVIDADES PAISAGÍSTICAS
00008131000115	BARBACENA ADMINISTRACAO DE BENS LTDA	GUILHERME DA SILVA	101	CAMPINAS	SP	GUILHERME DA SILVA 101 CAMPINAS SP 	-228975225	-470576169	13015028	ATIVIDADES IMOBILIÁRIAS
00008220000161	B.T.M. ELETROMECANICA LTDA	FRANCISCA LUZANIRA PINHEIRO CANDEA	127	GUARULHOS	SP	FRANCISCA LUZANIRA PINHEIRO CANDEA 127 GUARULHOS SP 	-234208707	-464239134	07172470	FABRICAÇÃO DE MÁQUINAS, APARELHOS E MATERIAIS ELÉTRICOS
00008286000151	GIZ PROPAGANDA E MARKETING LTDA	VIEIRA MACIEL	46	SAO PAULO	SP	VIEIRA MACIEL 46 SAO PAULO SP 	-235819808	-466652492	04503040	PUBLICIDADE E PESQUISA DE MERCADO
00008295000142	FREE TRANSPORTE DE CARGAS LTDA	ULISSES PASCHOAL	22	SAO PAULO	SP	ULISSES PASCHOAL 22 SAO PAULO SP 	-236633542	-466358891	04328040	TRANSPORTE TERRESTRE
00008305000140	FE NA VIDA PRODUCOES LTDA	DOM PEDRO II	08	GUARATINGUETA	SP	DOM PEDRO II 08 GUARATINGUETA SP 	-228036879	-4.51859E+15	12501020	IMPRESSÃO E REPRODUÇÃO DE GRAVAÇÕES
00008330000123	ECOM MONTAGENS E CONSTRUCOES LIMITADA	PLINIO PEREIRA NEVES	415	CAMPINAS	SP	PLINIO PEREIRA NEVES 415 CAMPINAS SP 	-229252401	-470641184	13041220	SERVIÇOS ESPECIALIZADOS PARA CONSTRUÇÃO
00008336000109	NETWORKSEC SOLUCOES DE SEGURANCA LTDA	DONA LIBANIA	2191	CAMPINAS	SP	DONA LIBANIA 2191 CAMPINAS SP 	-228956845	-470607909	13015090	ATIVIDADES DOS SERVIÇOS DE TECNOLOGIA DA INFORMAÇÃO
00008421000169	MAGNA FACTORING ASSESSORIA E NEGOCIOS LTDA	SILVA BUENO	1660	SAO PAULO	SP	SILVA BUENO 1660 SAO PAULO SP 	-235933674	-46601433	04208001	ATIVIDADES DE SERVIÇOS FINANCEIROS
00008439000160	CELAQUI PRODUTOS ALIMENTICIOS EIRELI	RODRIGUES BATISTA	57	SAO PAULO	SP	RODRIGUES BATISTA 57 SAO PAULO SP 	-2357875	-466200305	01546090	FABRICAÇÃO DE PRODUTOS ALIMENTÍCIOS
00008495000103	CENTER OLINDA MATERIAIS PARA CONSTRUCAO EIRELI	CLARETIANA	205	SAO PAULO	SP	CLARETIANA 205 SAO PAULO SP 	-236300026	-467544802	05765230	COMÉRCIO VAREJISTA
00008501000114	COMERCIO DE GAS FRANCISCO MORATO LTDA	PROF FRANCISCO MORATO	4841	SAO PAULO	SP	PROF FRANCISCO MORATO 4841 SAO PAULO SP 	-235983856	-467408097	05521200	COMÉRCIO VAREJISTA
00008504000158	APJ CONSULTORIA EMPRESARIAL EIRELI	MANOEL ACHE	980	RIBEIRAO PRETO	SP	MANOEL ACHE 980 RIBEIRAO PRETO SP 	-21208574	-478068693	14020590	ATIVIDADES DE SEDES DE EMPRESAS E DE CONSULTORIA EM GESTÃO EMPRESARIAL
00008567000104	ANFA CINE TELAS LTDA	REGO BARROS	1154	SAO PAULO	SP	REGO BARROS 1154 SAO PAULO SP 	-235679321	-465134727	03460000	FABRICAÇÃO DE PRODUTOS DE BORRACHA E DE MATERIAL PLÁSTICO
00008572000117	PRISMA TINTURARIA E ESTAMPARIA LTDA - EM RECUPERACAO JUDICIAL	ANHANGUERA, KM 124	3995	AMERICANA	SP	ANHANGUERA, KM 124 3995 AMERICANA SP 	-227368955	-472823994	13474000	FABRICAÇÃO DE PRODUTOS TÊXTEIS
00008657000103	STELUC PARTICIPACOES LTDA	PEQUETITA	145	SAO PAULO	SP	PEQUETITA 145 SAO PAULO SP 	-235924715	-4.66856E+15	04552060	ATIVIDADES DE SERVIÇOS FINANCEIROS
00008673000198	JAGUAR EQUIPAMENTOS ELETRO INDUSTRIAL LTDA	ROSA MENDES	577	PINHALZINHO	SP	ROSA MENDES 577 PINHALZINHO SP 	-22771904	-465573355	12995000	COMÉRCIO POR ATACADO, EXCETO VEÍCULOS AUTOMOTORES E MOTOCICLETAS
00008840000109	AGRO-PET COMERCIO E SERVICOS LTDA	MAJOR ZANANI	271	TREMEMBE	SP	MAJOR ZANANI 271 TREMEMBE SP 	-22961347	-455467468	12120000	COMÉRCIO VAREJISTA
00008892000177	NEVEPLAC MADEIRAS E FERRAGENS LIMITADA	RIO NEGRINHO	58	GUARULHOS	SP	RIO NEGRINHO 58 GUARULHOS SP 	-234454366	-46531315	07123280	COMÉRCIO VAREJISTA
00008907000105	MARCELO R R DE OLIVEIRA	DEPUTADO LUIS EDUARDO MAGALHAES	S/N	CAMPINAS	SP	DEPUTADO LUIS EDUARDO MAGALHAES S/N CAMPINAS SP 	-22945877	-471319538	13059715	COMÉRCIO VAREJISTA
00008947000149	PARIZ E GUARATO SUPRIMENTOS AUTOMOTIVOS LTDA	ZELIA	246	SAO BERNARDO DO CAMPO	SP	ZELIA 246 SAO BERNARDO DO CAMPO SP 	-237130695	-465826179	09861710	COMÉRCIO E REPARAÇÃO DE VEÍCULOS AUTOMOTORES E MOTOCICLETAS
00008955000195	RADANI ELETRONICA E AUTOMACAO LTDA	ZANZIBAR	645	SAO PAULO	SP	ZANZIBAR 645 SAO PAULO SP 	-235142333	-466594524	02512010	COMÉRCIO POR ATACADO, EXCETO VEÍCULOS AUTOMOTORES E MOTOCICLETAS
00009000000152	CONSULENZA - CONSULTORIA COMERCIAL EIRELI	NOVE DE JULHO	3575	JUNDIAI	SP	NOVE DE JULHO 3575 JUNDIAI SP 	-232026843	-46891697	13208056	SERVIÇOS DE ESCRITÓRIO, DE APOIO ADMINISTRATIVO E OUTROS SERVIÇOS PRESTADOS ÀS EMPRESAS
00009062000164	STAFF:S RECURSOS HUMANOS LTDA	JORGE TIBIRICA	3729	SAO JOSE DO RIO PRETO	SP	JORGE TIBIRICA 3729 SAO JOSE DO RIO PRETO SP 	-208158969	-4.93756E+15	15014040	SELEÇÃO, AGENCIAMENTO E LOCAÇÃO DE MÃO-DE-OBRA
00009178000101	ANIPRESS EDITORA LTDA	AGOSTINHO GOMES	2207	SAO PAULO	SP	AGOSTINHO GOMES 2207 SAO PAULO SP 	-2358995	-466038131	04206001	OUTRAS ATIVIDADES PROFISSIONAIS, CIENTÍFICAS E TÉCNICAS
00009184000150	OROCOTTON INDUSTRIA E COMERCIO DE CONFECCOES LTDA	JOSE PAULINO	257	SAO PAULO	SP	JOSE PAULINO 257 SAO PAULO SP 	-235319201	-466386829	01120001	CONFECÇÃO DE ARTIGOS DO VESTUÁRIO E ACESSÓRIOS
00009200000105	MILMAR TRANSPORTES EIRELI	TURISTICA DO JARAGUA	1970	SAO PAULO	SP	TURISTICA DO JARAGUA 1970 SAO PAULO SP 	-234762678	-4675313	05161000	TRANSPORTE TERRESTRE
00009225000109	AUTO POSTO CANTONI EIRELI	PIRES FERNANDES	530	GOIANIA	GO	PIRES FERNANDES 530 GOIANIA GO 	-166709185	-492721287	74070030	COMÉRCIO VAREJISTA
00009244000135	C A S CONTROLE AUTOMACAO E SISTEMAS LTDA	CRISTO REI	379	OSASCO	SP	CRISTO REI 379 OSASCO SP 	-234955956	-467895954	06246030	COMÉRCIO VAREJISTA
00009364000132	ANDRETTA REPRESENTACOES LTDA	MARIO ARAUJO	101	SAO PAULO	SP	MARIO ARAUJO 101 SAO PAULO SP 	-234970194	-466335251	02020100	COMÉRCIO POR ATACADO, EXCETO VEÍCULOS AUTOMOTORES E MOTOCICLETAS
00009378000156	DULAR MARTINOPOLIS MOVEIS E UTILIDADES DOMESTS LTDA	CEL. JOAO GOMES MARTINS	313	MARTINOPOLIS	SP	CEL. JOAO GOMES MARTINS 313 MARTINOPOLIS SP 	-221482971	-5.11698E+15	19500000	COMÉRCIO VAREJISTA
00009427000150	SKILL DO BRASIL LTDA	JOSE ROBERTO DE CAMARGO TOLEDO	226	SANTANA DE PARNAIBA	SP	JOSE ROBERTO DE CAMARGO TOLEDO 226 SANTANA DE PARNAIBA SP 	-234390301	-469427599	06504150	COMÉRCIO POR ATACADO, EXCETO VEÍCULOS AUTOMOTORES E MOTOCICLETAS
00009475000149	RONALDO BRUNATO	AMADOR BUENO	574	RIBEIRAO PRETO	SP	AMADOR BUENO 574 RIBEIRAO PRETO SP 	-211756584	-478114812	14010070	ALIMENTAÇÃO
00009491000131	TELLAIO TEXTIL LTDA	NOSSA SENHORA DE FATIMA	2700	AMERICANA	SP	NOSSA SENHORA DE FATIMA 2700 AMERICANA SP 	-227488817	-473052573	13478540	FABRICAÇÃO DE PRODUTOS TÊXTEIS
00009523000107	HENGEL LOCACOES E SERVICOS LTDA	DO MANGANEZ	610	ASSIS	SP	DO MANGANEZ 610 ASSIS SP 	-226415122	-503979431	19812080	ALUGUÉIS NÃO-IMOBILIÁRIOS E GESTÃO DE ATIVOS INTANGÍVEIS NÃO-FINANCEIROS
00009570000142	NEW SERVICE AR CONDICIONADO LTDA	GAIVOTA CINZA	871	SAO PAULO	SP	GAIVOTA CINZA 871 SAO PAULO SP 	-237679542	-467227095	04864270	SERVIÇOS ESPECIALIZADOS PARA CONSTRUÇÃO
00009638000193	IPERFOR INDUSTRAL LTDA EM RECUPERACAO JUDICIAL	PRINCIPE HUMBERTO (VL CAMPESTRE)	102	SAO BERNARDO DO CAMPO	SP	PRINCIPE HUMBERTO (VL CAMPESTRE) 102 SAO BERNARDO DO CAMPO SP 	-237051516	-46553769	09725200	FABRICAÇÃO DE PRODUTOS DE METAL, EXCETO MÁQUINAS E EQUIPAMENTOS
00009822000133	CONTROL PARTS EQUIPAMENTOS LTDA	DA BALSA	1328	SAO PAULO	SP	DA BALSA 1328 SAO PAULO SP 	-235066191	-467049876	02910055	COMÉRCIO E REPARAÇÃO DE VEÍCULOS AUTOMOTORES E MOTOCICLETAS
00009835000102	AGROPECUARIA CAMARGO + CAMARGO LTDA	FLORIANO PEIXOTO	1759	SANTA BARBARA D:OESTE	SP	FLORIANO PEIXOTO 1759 SANTA BARBARA D:OESTE SP 	-227481541	-474237135	13451050	COMÉRCIO VAREJISTA
00010038000145	ARAGUYRA PARTICIPACOES LTDA	CORONEL OSCAR PORTO	472	SAO PAULO	SP	CORONEL OSCAR PORTO 472 SAO PAULO SP 	-235733083	-466473401	04003002	ATIVIDADES DE SERVIÇOS FINANCEIROS
00010042000103	M.J. DA COSTA MERCEARIA	FONTANESIA	160	SAO PAULO	SP	FONTANESIA 160 SAO PAULO SP 	-235505199	-4.66333E+15	08041770	COMÉRCIO VAREJISTA
00010099000102	PANIFICADORA VITORIA DE PAULINIA LTDA	SAO BENTO	583	PAULINIA	SP	SAO BENTO 583 PAULINIA SP 	-22764652	-471589122	13140000	COMÉRCIO VAREJISTA
00010139000116	FRANCISCA ANTONIA MOTA RIO PRETO	JOSE DURAN	189	SAO JOSE DO RIO PRETO	SP	JOSE DURAN 189 SAO JOSE DO RIO PRETO SP 	-207781394	-493617057	15053320	COMÉRCIO POR ATACADO, EXCETO VEÍCULOS AUTOMOTORES E MOTOCICLETAS
00010205000158	DISTRIBUIDORA DADIVA DE CICLOPECAS LTDA	JOSE NEVES	505	SAO PAULO	SP	JOSE NEVES 505 SAO PAULO SP 	-23658219	-466752842	04650141	COMÉRCIO POR ATACADO, EXCETO VEÍCULOS AUTOMOTORES E MOTOCICLETAS
00010315000110	OLIVEIRA MACHADO REPRESENTACOES LTDA	RAFAELLE SCIAMARELLA	57	JACAREI	SP	RAFAELLE SCIAMARELLA 57 JACAREI SP 	-2331471	-459773209	12300000	COMÉRCIO POR ATACADO, EXCETO VEÍCULOS AUTOMOTORES E MOTOCICLETAS
00010364000152	DAINET MULTIMIDIA E COMUNICACOES LTDA	VERBO DIVINO	507	SAO PAULO	SP	VERBO DIVINO 507 SAO PAULO SP 	-236357839	-467013439	04719001	PUBLICIDADE E PESQUISA DE MERCADO
00010366000141	H METAL - INDUSTRIA METALURGICA LTDA	CLAUDOMIRO WOLSCH COSTA	128	ARACATUBA	SP	CLAUDOMIRO WOLSCH COSTA 128 ARACATUBA SP 	-212028539	-504536793	16078020	FABRICAÇÃO DE MÓVEIS
00010381000190	REAL ARACATUBA COM E IMPORTADORA MAQ E FERRAMENTAS LTDA	DOUTOR JOSE DOMINGOS DE ALMEIDA	800	ARACATUBA	SP	DOUTOR JOSE DOMINGOS DE ALMEIDA 800 ARACATUBA SP 	-212024412	-504581197	16072190	COMÉRCIO VAREJISTA
00010470000136	708N EMPREENDIMENTOS IMOBILIARIOS LTDA	SCRN 708/709	14	BRASILIA	DF	SCRN 708/709 14 BRASILIA DF 	-157634306	-478916571	70741600	CONSTRUÇÃO DE EDIFÍCIOS
00010507000126	ATMOSPHERA COMERCIO PROJETOS E PAISAGISMO LTDA	ELISEU DE ALMEIDA	1251	SAO PAULO	SP	ELISEU DE ALMEIDA 1251 SAO PAULO SP 	-235809004	-467219848	05533000	SERVIÇOS PARA EDIFÍCIOS E ATIVIDADES PAISAGÍSTICAS
00010511000194	PEDREIRA ALVORADA LTDA	RAPOSO TAVARES	SN	ANGATUBA	SP	RAPOSO TAVARES SN ANGATUBA SP 	-234948382	-4.84138E+15	18240000	EXTRAÇÃO DE MINERAIS NÃO-METÁLICOS
00010551000136	MARCIA REGINA GOMES - TELECOMUNICACOES	DOMINGOS JOSE MARTINS	118	SANTOS	SP	DOMINGOS JOSE MARTINS 118 SANTOS SP 	-239488621	-463662107	11085800	COMÉRCIO VAREJISTA
00010627000123	SILVA, CARVALHO + CIA. SUPERMERCADOS LTDA	PINHEIRO MACHADO	501	AVARE	SP	PINHEIRO MACHADO 501 AVARE SP 	-231055379	-489312271	18705370	COMÉRCIO VAREJISTA
00010640000182	POLY SELL PRODUTOS QUIMICOS LTDA	HUMBERTO PELA	103	LOUVEIRA	SP	HUMBERTO PELA 103 LOUVEIRA SP 	-231016091	-469450555	13290000	FABRICAÇÃO DE PRODUTOS FARMOQUÍMICOS E FARMACÊUTICOS
00010727000150	PADARIA CAPANEMA + MUSSOLINI LTDA	CAMPOS SALLES	1141	BEBEDOURO	SP	CAMPOS SALLES 1141 BEBEDOURO SP 	-209492587	-484842002	14700420	COMÉRCIO VAREJISTA
00010756000111	MYRIAN PEREIRA MODOTTE CHIARA	RUI BARBOSA	612	ASSIS	SP	RUI BARBOSA 612 ASSIS SP 	-226617754	-50415176	19800003	COMÉRCIO VAREJISTA
00010836000177	AILTON MAUAD	PADRE JOAO	10-40	BAURU	SP	PADRE JOAO 10-40 BAURU SP 	-223311495	-490691887	17012020	ATIVIDADES IMOBILIÁRIAS
00010841000180	SOLVE CONSTRUTORA LTDA	SAO CAMILO	384	COTIA	SP	SAO CAMILO 384 COTIA SP 	-235869078	-468330414	06709150	CONSTRUÇÃO DE EDIFÍCIOS
00010865000139	HRR COMERCIO E INDUSTRIA DE MATERIAIS ELETRICOS LTDA	JOACABA	80	SAO JOSE DOS CAMPOS	SP	JOACABA 80 SAO JOSE DOS CAMPOS SP 	-232559327	-459245421	12238530	COMÉRCIO VAREJISTA
00010987000125	SD CONSULTORIA E PROJETOS LTDA	FABIO MONTENEGRO	04	SANTOS	SP	FABIO MONTENEGRO 04 SANTOS SP 	-23964442	-463290962	11060475	ATIVIDADES DE SEDES DE EMPRESAS E DE CONSULTORIA EM GESTÃO EMPRESARIAL
00011009000106	FIBRAFORTE ENGENHARIA, INDUSTRIA E COMERCIO LTDA	JOSE SIERRA	121	SAO JOSE DOS CAMPOS	SP	JOSE SIERRA 121 SAO JOSE DOS CAMPOS SP 	-232662822	-459137992	12238571	"SERVIÇOS DE ARQUITETURA E ENGENHARIA
