TAG	RAZSOC	ENDERECO	COMPL	LOCALIDADE	UF	Full Address	Latitude	Longitude	CEP	U_DESCNAE
00020281000144	CASA SONIA MATERIAIS PARA CONSTRUCAO LTDA	MARTIN LUTHER KING JUNIOR	174	SAO BERNARDO DO CAMPO	SP	MARTIN LUTHER KING JUNIOR 174 SAO BERNARDO DO CAMPO SP 	-236911793	-46571479	09890060	COMÉRCIO VAREJISTA
00020298000100	PLANO DIGITAL COMUNICACAO LTDA	SRTV/SUL, QUADRA 701, BLOCO O	110	BRASILIA	DF	SRTV/SUL, QUADRA 701, BLOCO O 110 BRASILIA DF 	-15797313	-47894731	70340000	ATIVIDADES DOS SERVIÇOS DE TECNOLOGIA DA INFORMAÇÃO
00020375000113	SIMPLES ASSIM COMERCIO E LOCACAO DE EQUIPAMENTOS DE INFORMATICA LTDA	MARTINS	429	SAO BERNARDO DO CAMPO	SP	MARTINS 429 SAO BERNARDO DO CAMPO SP 	-236670649	-465921368	09772040	ALUGUÉIS NÃO-IMOBILIÁRIOS E GESTÃO DE ATIVOS INTANGÍVEIS NÃO-FINANCEIROS
00020484000130	ALIANCA INDUSTRIA, COMERCIO DE TINTAS E PINTURA LTDA	BENTO DO AMARAL GURGEL	1.568	JUNDIAI	SP	BENTO DO AMARAL GURGEL 1.568 JUNDIAI SP 	-231928322	-468539901	13219070	FABRICAÇÃO DE PRODUTOS DE METAL, EXCETO MÁQUINAS E EQUIPAMENTOS
00020534000180	RODOVIARIO GARCIA DE PIRANGI LTDA	BENJAMIN CONSTANT	2107	PIRANGI	SP	BENJAMIN CONSTANT 2107 PIRANGI SP 	-211015211	-486640873	15820000	TRANSPORTE TERRESTRE
00020540000137	MELPAPER LTDA.	TITO	479	SAO PAULO	SP	TITO 479 SAO PAULO SP 	-23528385	-4.66966E+15	05051000	ATIVIDADES DE SERVIÇOS FINANCEIROS
00020575000176	MILIORINI + ORTIS LTDA	BRASIL	229	TARUMA	SP	BRASIL 229 TARUMA SP 	-22749682	-505792963	19820000	COMÉRCIO VAREJISTA
00020601000166	JOSE ALEXANDRE FAVERI	ARAUCARIA	376	LIMEIRA	SP	ARAUCARIA 376 LIMEIRA SP 	-225838264	-474097695	13480970	FABRICAÇÃO DE PRODUTOS DIVERSOS
00020606000199	SECOL-MATERIAIS PARA CONSTRUCAO LTDA	LITERIO GRECCO	1133	FERNANDOPOLIS	SP	LITERIO GRECCO 1133 FERNANDOPOLIS SP 	-20271633	-50252864	15600000	COMÉRCIO VAREJISTA
00020621000137	PLANETA AZUL INDUSTRIA, COMERCIO, IMPORTACAO E EXPORTACAO DE ESPECIALIDADES QUIMICAS LTDA	LEME DA SILVA	63	SAO PAULO	SP	LEME DA SILVA 63 SAO PAULO SP 	-235589633	-465904947	03182030	FABRICAÇÃO DE PRODUTOS QUÍMICOS
00020622000181	MERCEARIA NOGUEIRA DE BRAGANCA PAULISTA LTDA	ALONSO CINTRA AMARAL	11	BRAGANCA PAULISTA	SP	ALONSO CINTRA AMARAL 11 BRAGANCA PAULISTA SP 	-229376987	-465392989	12908530	ALIMENTAÇÃO
00020640000163	ADESPOINT COMERCIO DE PAPEIS EIRELI	ITAQUERI	213	SAO PAULO	SP	ITAQUERI 213 SAO PAULO SP 	-235504864	-465829069	03178000	COMÉRCIO POR ATACADO, EXCETO VEÍCULOS AUTOMOTORES E MOTOCICLETAS
00020648000120	PRODIGO FILMS LTDA	CERRO CORA	408	SAO PAULO	SP	CERRO CORA 408 SAO PAULO SP 	-235407239	-46701097	05061000	"ATIVIDADES CINEMATOGRÁFICAS, PRODUÇÃO DE VÍDEOS E DE PROGRAMAS DE TELEVISÃO
00020653000132	MULLYS SCREEN COMERCIO DE SILK SCREEN LTDA	LOURENCO FRANCO	325	SAO PAULO	SP	LOURENCO FRANCO 325 SAO PAULO SP 	-236090941	-4.65248E+15	03258000	COMÉRCIO VAREJISTA
00020657000110	EDITORA DA TRIBO LTDA	DA MATINHA	3520	SAO JOSE DO RIO PRETO	SP	DA MATINHA 3520 SAO JOSE DO RIO PRETO SP 	-208563558	-494281605	15091450	EDIÇÃO E EDIÇÃO INTEGRADA À IMPRESSÃO
00020660000134	PASCON + OCCIK LTDA	RIO CLARO/IPEUNA	10	RIO CLARO	SP	RIO CLARO/IPEUNA 10 RIO CLARO SP 	-223906153	-475753898	13500000	"COLETA, TRATAMENTO E DISPOSIÇÃO DE RESÍDUOS
00020682000102	TRANSPORTADORA  SIDER  LIMEIRA EIRELI	LUIZ VARGA	2255	LIMEIRA	SP	LUIZ VARGA 2255 LIMEIRA SP 	-225678406	-473805044	13486605	TRANSPORTE TERRESTRE
00020686000182	G.D.S. MULOTO COMERCIO E INDUSTRIA LTDA	PADRE SEGUNDO QUESSADA	235	BOTUCATU	SP	PADRE SEGUNDO QUESSADA 235 BOTUCATU SP 	-22868681	-484815897	18608849	COMÉRCIO VAREJISTA
00020707000160	COMERCIAL FERRAGENS SAO RAFAEL LTDA	BARONESA DE MURITIBA	836	SAO PAULO	SP	BARONESA DE MURITIBA 836 SAO PAULO SP 	-236303693	-4.64701E+15	08311080	COMÉRCIO VAREJISTA
00020725000141	BATIKI COMERCIO IMPORTACAO E EXPORTACAO LTDA	LAUDICERIO MENDES DE OLIVEIRA	750	JACI	SP	LAUDICERIO MENDES DE OLIVEIRA 750 JACI SP 	-208924001	-495685827	15155000	COMÉRCIO POR ATACADO, EXCETO VEÍCULOS AUTOMOTORES E MOTOCICLETAS
00020762000150	SCHOTT GASES LTDA	DO BONSUCESSO	6360	ITAQUAQUECETUBA	SP	DO BONSUCESSO 6360 ITAQUAQUECETUBA SP 	-234502482	-463800408	08579000	COMÉRCIO VAREJISTA
00020775000129	COOPERATIVA HABITACIONAL NOSSO LAR DA BAIXADA SANTISTA	ANTONIO EMMERICK	693	SAO VICENTE	SP	ANTONIO EMMERICK 693 SAO VICENTE SP 	-239601617	-463771007	11370001	ATIVIDADES DE ORGANIZAÇÕES ASSOCIATIVAS
00020777000118	CESVI-BRASIL CENTRO DE EXPERIMENTACAO E SEGURANCA VIARIA LTDA	AMADOR AGUIAR	700	SAO PAULO	SP	AMADOR AGUIAR 700 SAO PAULO SP 	-23442006	-46729583	02998020	SERVIÇOS DE ESCRITÓRIO, DE APOIO ADMINISTRATIVO E OUTROS SERVIÇOS PRESTADOS ÀS EMPRESAS
00020778000162	FRISON CONVENIENCE SERVICOS AUTOMOTIVOS LTDA	SANTA JUSTINA	114	SAO PAULO	SP	SANTA JUSTINA 114 SAO PAULO SP 	-235943959	-466743819	04545040	COMÉRCIO E REPARAÇÃO DE VEÍCULOS AUTOMOTORES E MOTOCICLETAS
00020783000175	W ESTEVES INDUSTRIA E COMERCIO DE ARTEFATOS DE ARAME LIMITADA	CONDE DE FRONTIM	2164	SAO PAULO	SP	CONDE DE FRONTIM 2164 SAO PAULO SP 	-235329786	-465364792	03501000	FABRICAÇÃO DE PRODUTOS DE METAL, EXCETO MÁQUINAS E EQUIPAMENTOS
00020788000106	MADER - COMERCIAL E IMPORTADORA QUIMICA E FARMACEUTICA LTDA	URUGUAI	85	CAPIVARI	SP	URUGUAI 85 CAPIVARI SP 	-229884899	-475109051	13360000	COMÉRCIO POR ATACADO, EXCETO VEÍCULOS AUTOMOTORES E MOTOCICLETAS
00020846000193	AVANT NEGOCIOS IMOBILIARIOS LTDA.	GISELE CONSTANTINO 1850	1850	VOTORANTIM	SP	GISELE CONSTANTINO 1850 1850 VOTORANTIM SP 	-235360247	-474644396	18110902	ATIVIDADES DE SERVIÇOS FINANCEIROS
00020980000194	BSE SISTEMAS ELETRONICOS LTDA	PEDRO PROCOPIO	88	SANTANA DE PARNAIBA	SP	PEDRO PROCOPIO 88 SANTANA DE PARNAIBA SP 	-234461571	-4691784	06501130	ATIVIDADES DOS SERVIÇOS DE TECNOLOGIA DA INFORMAÇÃO
00021039000195	S. M. WATANABE + FILHOS LTDA	JOSE MARTINEZ MOLINA	123	PIRAPOZINHO	SP	JOSE MARTINEZ MOLINA 123 PIRAPOZINHO SP 	-222711136	-515011887	19200000	COMÉRCIO POR ATACADO, EXCETO VEÍCULOS AUTOMOTORES E MOTOCICLETAS
00021051000108	VIDEO EXPRESS PRODUCAO DE AUDIO VISUAL LTDA	HUMBERTO I	648	SAO PAULO	SP	HUMBERTO I 648 SAO PAULO SP 	-235858419	-466416589	04018030	"ATIVIDADES CINEMATOGRÁFICAS, PRODUÇÃO DE VÍDEOS E DE PROGRAMAS DE TELEVISÃO
00021076000101	CLASSINOX COM DE UTILIDADES DOMESTICAS E FERRAGENS LTDA	ITAQUI	279	SAO PAULO	SP	ITAQUI 279 SAO PAULO SP 	-23528781	-466197986	03029090	COMÉRCIO POR ATACADO, EXCETO VEÍCULOS AUTOMOTORES E MOTOCICLETAS
00021096000417	INVISTA FIBRAS E POLIMEROS BRASIL LTDA.	BORTOLO FERRO	500	PAULINIA	SP	BORTOLO FERRO 500 PAULINIA SP 	-22754894	-471457515	13148902	FABRICAÇÃO DE PRODUTOS TÊXTEIS
00021109000105	VISUAL MANEQUINS LTDA	VINTE E UM DE ABRIL	631	SAO PAULO	SP	VINTE E UM DE ABRIL 631 SAO PAULO SP 	-235431815	-466090178	03047000	FABRICAÇÃO DE PRODUTOS DE METAL, EXCETO MÁQUINAS E EQUIPAMENTOS
00021110000130	WARE HOUSE COMERCIO E SERVICOS LTDA	PADRE PERICLES	145	SAO PAULO	SP	PADRE PERICLES 145 SAO PAULO SP 	-235313005	-466637049	01156040	COMÉRCIO POR ATACADO, EXCETO VEÍCULOS AUTOMOTORES E MOTOCICLETAS
00021119000140	CONSTRUKA CONSTRUCAO CIVIL EIRELI	PANAPOI	74	SAO PAULO	SP	PANAPOI 74 SAO PAULO SP 	-236233059	-466692906	04616030	OBRAS DE INFRA-ESTRUTURA
00021187000100	PAMPLONA SERVICOS DE INSTALACAO E MONTAGEM LTDA	TUMIARU	385	SANTO ANDRE	SP	TUMIARU 385 SANTO ANDRE SP 	-236485919	-465059114	09290120	COMÉRCIO VAREJISTA
00021224000180	HERCULES CATANZARO	CELSO VIEIRA	45	SAO PAULO	SP	CELSO VIEIRA 45 SAO PAULO SP 	-234910478	-467186307	02919120	FABRICAÇÃO DE MÁQUINAS, APARELHOS E MATERIAIS ELÉTRICOS
00021271000123	NAPER COMERCIO E SERVICOS LTDA	ARANDU	57	SAO PAULO	SP	ARANDU 57 SAO PAULO SP 	-236110636	-466938124	04562030	ATIVIDADES IMOBILIÁRIAS
00021280000114	R K PAIM KASSAB + CIA LTDA	DOS EXPEDICIONARIOS	211	PINDAMONHANGABA	SP	DOS EXPEDICIONARIOS 211 PINDAMONHANGABA SP 	-229262555	-454597573	12400370	COMÉRCIO VAREJISTA
00021333000105	SERRALHERIA MELO SJCAMPOS	CARIRI	33	SAO JOSE DOS CAMPOS	SP	CARIRI 33 SAO JOSE DOS CAMPOS SP 	-232549334	-459234961	12238300	FABRICAÇÃO DE PRODUTOS DE METAL, EXCETO MÁQUINAS E EQUIPAMENTOS
00021425000187	CONDOVEL ADMINISTRADORA E IMOBILIARIA LTDA	DOUTOR ABELARDO VERGUEIRO CESAR	528	SAO PAULO	SP	DOUTOR ABELARDO VERGUEIRO CESAR 528 SAO PAULO SP 	-236397285	-4.66721E+15	04635080	ATIVIDADES IMOBILIÁRIAS
00021475000164	POSTO NOSSA SENHORA DE FATIMA BAURU LTDA	BERNARDINO DE CAMPOS	7-77	BAURU	SP	BERNARDINO DE CAMPOS 7-77 BAURU SP 	-223309386	-490875418	17050040	COMÉRCIO VAREJISTA
00021496000180	SAHESP SAO PAULO SANEAMENTO HIDRICO LTDA	DR SEBASTIAO LAPETINA RUSSO	175	SAO PAULO	SP	DR SEBASTIAO LAPETINA RUSSO 175 SAO PAULO SP 	-236561783	-467163446	04753110	ATIVIDADES DE ATENÇÃO À SAÚDE HUMANA
00021512000134	REPROCHEM INDUSTRIA E COMERCIO DE PRODUTOS QUIMICOS LTDA	SAMPAIO CORREA	195	SAO PAULO	SP	SAMPAIO CORREA 195 SAO PAULO SP 	-235100551	-46675303	02710080	FABRICAÇÃO DE PRODUTOS DE MINERAIS NÃO-METÁLICOS
00021522000170	SUTUR CAMP COMERCIO DE PRODUTOS CIRURGICOS HOSPITALARES LTDA	CURITIBA	447	NOVA ODESSA	SP	CURITIBA 447 NOVA ODESSA SP 	-227892331	-472847674	13460000	COMÉRCIO VAREJISTA
00021575000190	BAR E LANCHES AMADORA LTDA	LUIZ FACCINI	108	GUARULHOS	SP	LUIZ FACCINI 108 GUARULHOS SP 	-234688656	-465261721	07110000	ALIMENTAÇÃO
00021619000182	MAREL MANUTENCAO PREDIAL LTDA	BONAVENTURA VIVIANI	59	SAO PAULO	SP	BONAVENTURA VIVIANI 59 SAO PAULO SP 	-234447314	-467362166	02996040	COMÉRCIO VAREJISTA
00021622000104	REBARPECAS - INDUSTRIA E BENEFICIAMENTO DE PECAS MECANICAS LTDA	ANTONIO ROBERTO DELLA VECHIA	20	MONTE ALTO	SP	ANTONIO ROBERTO DELLA VECHIA 20 MONTE ALTO SP 	-21263736	-4846433	15910000	FABRICAÇÃO DE OUTROS EQUIPAMENTOS DE TRANSPORTE, EXCETO VEÍCULOS AUTOMOTORES
00021717000110	J CEGA REPRESENTACOES COMERCIAIS LTDA	33-A	142	GOIANIA	GO	33-A 142 GOIANIA GO 	-166754091	-492747287	74070180	COMÉRCIO POR ATACADO, EXCETO VEÍCULOS AUTOMOTORES E MOTOCICLETAS
00021726000100	PAULO EDUARDO BERTELLI	QUATA	38	CAMPINAS	SP	QUATA 38 CAMPINAS SP 	-229279447	-470682434	13040013	COMÉRCIO POR ATACADO, EXCETO VEÍCULOS AUTOMOTORES E MOTOCICLETAS
00021755000172	NOLVER INFORMATICA LTDA	PE. FRANCISCO RODRIGUES DOS SANTOS	54	ATIBAIA	SP	PE. FRANCISCO RODRIGUES DOS SANTOS 54 ATIBAIA SP 	-231141478	-465577019	12940250	TELECOMUNICAÇÕES
00021776000198	GIOVANNI POINT SUPER LANCHES LTDA	GIOVANNI GRONCHI	5091	SAO PAULO	SP	GIOVANNI GRONCHI 5091 SAO PAULO SP 	-236243152	-467337024	05724003	ALIMENTAÇÃO
00021778000187	P. NECHAR + CIA LTDA	SERGIPE	1218	CATANDUVA	SP	SERGIPE 1218 CATANDUVA SP 	-21132901	-48981207	15801300	COMÉRCIO VAREJISTA
00021788000112	ABB INFORMATICA LTDA	ANTONIO MADI	409	SAO PAULO	SP	ANTONIO MADI 409 SAO PAULO SP 	-236406945	-466480569	04347000	ATIVIDADES DOS SERVIÇOS DE TECNOLOGIA DA INFORMAÇÃO
00021833000139	ZILDA B C RODRIGUEZ	MARTINHO DE CAMPOS	112	SAO PAULO	SP	MARTINHO DE CAMPOS 112 SAO PAULO SP 	-23516427	-467192422	05093050	COMÉRCIO POR ATACADO, EXCETO VEÍCULOS AUTOMOTORES E MOTOCICLETAS
00021926000163	JOSE CARLOS CACHONI	DA IMPRENSA	184	LENCOIS PAULISTA	SP	DA IMPRENSA 184 LENCOIS PAULISTA SP 	-225817726	-488116976	18685390	COMÉRCIO VAREJISTA
00022014000106	GRADDUAL PARTICIPACOES LTDA.	ANGELICA	688	SAO PAULO	SP	ANGELICA 688 SAO PAULO SP 	-235388239	-4.66554E+15	01228000	ATIVIDADES IMOBILIÁRIAS
00022022000152	SELL - MAC MAQUINAS E EQUIPAMENTOS LTDA	SOLON	690	SAO PAULO	SP	SOLON 690 SAO PAULO SP 	-23524888	-466430064	01127010	COMÉRCIO POR ATACADO, EXCETO VEÍCULOS AUTOMOTORES E MOTOCICLETAS
00022090000111	SLG COMERCIO DE SISTEMAS DE AUTOMACAO LTDA	ALVARENGA	1995	SAO PAULO	SP	ALVARENGA 1995 SAO PAULO SP 	-235641647	-467119663	05509004	SERVIÇOS ESPECIALIZADOS PARA CONSTRUÇÃO
00022106000196	ENGEHIDRO EQUIPAMENTOS HIDRAULICOS PIRACICABA LTDA	ABEL F.PEREIRA	501	PIRACICABA	SP	ABEL F.PEREIRA 501 PIRACICABA SP 	-227291599	-476717631	13403016	COMÉRCIO VAREJISTA
00022107000130	REFORMAK - INDUSTRIA E COMERCIO DE MAQUINAS LTDA	PLINIO TOREZAN	47	JUNDIAI	SP	PLINIO TOREZAN 47 JUNDIAI SP 	-232093305	-468791587	13206082	FABRICAÇÃO DE MÁQUINAS E EQUIPAMENTOS
00022128000156	TITRONIC PLASTICOS INDUSTRIAIS LTDA	NESTOR GUISSO	304	SERRA	ES	NESTOR GUISSO 304 SERRA ES 	-202386587	-40283531	29161019	COMÉRCIO POR ATACADO, EXCETO VEÍCULOS AUTOMOTORES E MOTOCICLETAS
00022130000125	UNIODONTO DE CACAPAVA COOPERATIVA ODONTOLOGICA	CORONEL JOAO DIAS GUIMARAES	20	CACAPAVA	SP	CORONEL JOAO DIAS GUIMARAES 20 CACAPAVA SP 	-231025197	-457086028	12281350	ATIVIDADES DE ATENÇÃO À SAÚDE HUMANA
00022138000191	LAZINHO ARMAZENS LOGISTICA E TRANSPORTES LTDA	VEREADOR SAMUEL BERTO	622	LIMEIRA	SP	VEREADOR SAMUEL BERTO 622 LIMEIRA SP 	-225656101	-473887734	13486054	TRANSPORTE TERRESTRE
00022187000124	AGRO FELIX LTDA	DR. PLINIO SALGADO	5647	BRAGANCA PAULISTA	SP	DR. PLINIO SALGADO 5647 BRAGANCA PAULISTA SP 	-229055708	-465443104	12922230	COMÉRCIO POR ATACADO, EXCETO VEÍCULOS AUTOMOTORES E MOTOCICLETAS
00022193000181	RZN HOMEOPATIA E MANIPULACAO LTDA	ANTONIO SOARES	344	SOROCABA	SP	ANTONIO SOARES 344 SOROCABA SP 	-235091037	-474651388	18040570	COMÉRCIO VAREJISTA
00022244000175	COPOCENTRO INDUSTRIA DE PLASTICOS LTDA	PRIMARIA 03-D	S/N	ANAPOLIS	GO	PRIMARIA 03-D S/N ANAPOLIS GO 	-163286427	-4.89534E+15	75132095	FABRICAÇÃO DE PRODUTOS DE BORRACHA E DE MATERIAL PLÁSTICO
00022264000146	LOCAL ARMAZENS GERAIS LTDA	DOS CASA	2301	SAO BERNARDO DO CAMPO	SP	DOS CASA 2301 SAO BERNARDO DO CAMPO SP 	-237351655	-465678049	09840000	ARMAZENAMENTO E ATIVIDADES AUXILIARES DOS TRANSPORTES
00022307000193	RIB-THERM - ISOLAMENTOS TERMICOS LTDA	MANOEL FERNANDES	545	RIBEIRAO PRETO	SP	MANOEL FERNANDES 545 RIBEIRAO PRETO SP 	-211805662	-4.77625E+15	14092320	FABRICAÇÃO DE PRODUTOS DE METAL, EXCETO MÁQUINAS E EQUIPAMENTOS
00022321000197	C. B. C. SERVICOS + COMERCIO DE PECAS LTDA	BERTHOLDO FERNANDES DE CASTRO	119	CAMPINAS	SP	BERTHOLDO FERNANDES DE CASTRO 119 CAMPINAS SP 	-229549439	-470921064	13051114	COMÉRCIO POR ATACADO, EXCETO VEÍCULOS AUTOMOTORES E MOTOCICLETAS
00022324000120	SM COMPANIES COMERCIO E SERVICOS LTDA	GERALDO DE SOUZA	49	SUMARE	SP	GERALDO DE SOUZA 49 SUMARE SP 	-228272735	-472658446	13170232	ALIMENTAÇÃO
00022360000194	CHOCOLATERIA BRAGANCA LTDA	BENEVENUTO MORETTO	S/N	TUIUTI	SP	BENEVENUTO MORETTO S/N TUIUTI SP 	-228169077	-4.66878E+15	12930000	COMÉRCIO VAREJISTA
00022385000198	BOARA AGRICULTURA LIMITADA	RECANTO - CAIXA POSTAL 1288	S/N	PIRACICABA	SP	RECANTO - CAIXA POSTAL 1288 S/N PIRACICABA SP 	-227626467	-478427298	13405190	ATIVIDADES IMOBILIÁRIAS
00022386000132	ABO AGRICULTURA LIMITADA	MATAO	S/N	PIRACICABA	SP	MATAO S/N PIRACICABA SP 	-22750158	-476590517	13400970	ATIVIDADES IMOBILIÁRIAS
00022404000186	RIMEP MOTORES EIRELI	JOAO LEONARDO FUSTAINO	380	PIRACICABA	SP	JOAO LEONARDO FUSTAINO 380 PIRACICABA SP 	-22665459	-476020682	13413102	COMÉRCIO VAREJISTA
00022416000100	OPERATOR ASSESSORIA E ANALISES AMBIENTAIS LTDA.	ITAFARMA	88	COTIA	SP	ITAFARMA 88 COTIA SP 	-236022439	-468720927	06715795	"SERVIÇOS DE ARQUITETURA E ENGENHARIA
00022499000138	HOLLYWOOD EMBALAGENS LTDA	SOLON PEREIRA	1035	APARECIDA	SP	SOLON PEREIRA 1035 APARECIDA SP 	-228452144	-452499902	12570000	FABRICAÇÃO DE CELULOSE, PAPEL E PRODUTOS DE PAPEL
